"Rank","NCT Number","Title","Acronym","Status","Study Results","Conditions","Interventions","Outcome Measures","Sponsor/Collaborators","Gender","Age","Phases","Enrollment","Funded Bys","Study Type","Study Designs","Other IDs","Start Date","Primary Completion Date","Completion Date","First Posted","Results First Posted","Last Update Posted","Locations","Study Documents","URL"
1,"NCT02275104","Multimodal Image Processing Software to Guide Cardiac Ablation Therapy","MIGAT","Completed","No Results Available","Ventricular Arrhythmias|Persistent Atrial Fibrillation","Device: Contrast-enhanced ECG-gated multi-detector computed tomography|Device: Magnetic resonance imaging|Device: Positron emission tomography|Device: Body surface mapping|Procedure: Cardiac ablation procedure","To build MIGAT software|To test MIGAT for real-time guidance during cardiac ablation procedures.|To improve the compatibility of MIGAT with daily clinical use|Correlations between MIGAT predictions from non-invasive data, and ablation targets observed during invasive procedures","University Hospital, Bordeaux","All","18 Years and older   (Adult, Older Adult)",,"100","Other","Observational","Observational Model: Cohort|Time Perspective: Retrospective","CHUBX 2013/35","September 1, 2014","July 21, 2016","July 21, 2016","October 27, 2014",,"February 17, 2017","Hôpital cardiologique du Haut-Lévêque, Pessac, France",,"https://ClinicalTrials.gov/show/NCT02275104"
2,"NCT03151512","UNDISTORT Correction of Distortions in Diffusion MRI V1.0","UNDISTORT","Unknown status","No Results Available","MR Image Distortion Correction|Prostate Cancer",,"Dice similarity score to assess distortions|Radiological scoring of image quality|Diffusion coefficient consistency","University College, London","All","18 Years to 120 Years   (Adult, Older Adult)",,"155","Other","Observational","Observational Model: Cohort|Time Perspective: Prospective","16/0128","March 29, 2017","January 2020","March 2020","May 12, 2017",,"May 12, 2017","University College London Hospital, London, United Kingdom",,"https://ClinicalTrials.gov/show/NCT03151512"
3,"NCT03790930","Deep-learning Based Classification of Spine CT","DETECT","Recruiting","No Results Available","Surgical Procedure, Unspecified","Diagnostic Test: deep learning","classification accuracy|segmentation accuracy","Shanghai 10th People's Hospital|Third Affiliated Hospital, Sun Yat-Sen University","All","18 Years to 65 Years   (Adult, Older Adult)",,"500","Other","Observational","Observational Model: Case-Only|Time Perspective: Retrospective","SHSY180624","February 22, 2019","May 2020","May 2020","January 2, 2019",,"May 12, 2020","Shanghai Tenth People's Hospital, Shanghai, Shanghai, China",,"https://ClinicalTrials.gov/show/NCT03790930"
4,"NCT03894254","Predictive Factors of Autonomy Loss in Real-life Cohort","MEM-AURA","Not yet recruiting","No Results Available","Memory Disorders","Other: no intervention","Functional autonomy level","Hospices Civils de Lyon","All","18 Years and older   (Adult, Older Adult)","Not Applicable","5250","Other","Interventional","Allocation: N/A|Intervention Model: Single Group Assignment|Masking: None (Open Label)|Primary Purpose: Health Services Research","69HCL18_0613","April 1, 2019","March 1, 2024","March 1, 2032","March 28, 2019",,"March 28, 2019",,,"https://ClinicalTrials.gov/show/NCT03894254"
5,"NCT02302482","Predictive Factors and Autonomy Level Change","MEMORA","Recruiting","No Results Available","Memory Impairment","Other: The Lawton Instrumental Activities of Daily Living score (IADL), and the disability assessment of dementia score (DAD-6","Functional autonomy level|Cognitive function level","Hospices Civils de Lyon","All","65 Years and older   (Older Adult)","Not Applicable","6780","Other","Interventional","Allocation: N/A|Intervention Model: Single Group Assignment|Masking: None (Open Label)|Primary Purpose: Health Services Research","2014.868","November 2014","November 2023","November 2023","November 27, 2014",,"May 23, 2017","Hôpital Dugoujon, Caluire-et-Cuire, France|Hospices Civils de Lyon - Hôpital des Charpennes, Lyon, France",,"https://ClinicalTrials.gov/show/NCT02302482"
6,"NCT04368481","MRI Incidental Finding Deep Learning Identification","MIDI","Recruiting","No Results Available","Neurological Disorder","Diagnostic Test: Deep Learning Algorithm","Sensitivity and specificity of a deep learning computer algorithm (termed a convolutional neural network) to recognise abnormalities on cranial MRI scans.|Sensitivity and specificity of a deep learning computer algorithm to broadly categorise abnormalities on cranial MRI scans.","King's College Hospital NHS Trust","All","18 Years and older   (Adult, Older Adult)",,"30000","Other","Observational","Observational Model: Other|Time Perspective: Other","KCH18-197","April 1, 2019","October 20, 2023","November 20, 2023","April 29, 2020",,"April 29, 2020","Guy's Hospital, London, United Kingdom|King's College Hospital, London, United Kingdom|St George's Hospital, London, United Kingdom|St Thomas' Hospital, London, United Kingdom",,"https://ClinicalTrials.gov/show/NCT04368481"
7,"NCT04056650","Assessing the Effectiveness of an N-of-1 Platform Using Study of Cognitive Enhancers",,"Recruiting","No Results Available","Cognitive Performance","Drug: L-theanine|Dietary Supplement: Caffeine supplement|Device: N1 app","Percent of individuals who reach study completion|Percent of completed n-of-1 trials that yield statistically meaningful results.|Study adherence.","Icahn School of Medicine at Mount Sinai","All","18 Years and older   (Adult, Older Adult)","Phase 4","640","Other","Interventional","Allocation: Randomized|Intervention Model: Crossover Assignment|Masking: None (Open Label)|Primary Purpose: Device Feasibility","GCO 18-0756","October 18, 2019","September 2, 2020","September 2, 2020","August 14, 2019",,"February 21, 2020","Icahn School of Medicine at Mount Sinai, New York, New York, United States",,"https://ClinicalTrials.gov/show/NCT04056650"
8,"NCT03706664","Small Bowel Deep Learning Algorithm Project",,"Active, not recruiting","No Results Available","Crohn Disease","Other: Machine learning algorithm","Machine learning algorithm's ability to accurately localize the terminal ileum.|Data processing time until a diagnosis reported by algorithm.|Machine learning algorithm's ability to accurately distinguish abnormal and normal terminal ileum.","London North West Healthcare NHS Trust|Imperial College London","All","16 Years and older   (Child, Adult, Older Adult)","Not Applicable","226","Other","Interventional","Allocation: Randomized|Intervention Model: Single Group Assignment|Masking: None (Open Label)|Primary Purpose: Diagnostic","IRAS No:238924","March 1, 2019","November 2020","January 2021","October 16, 2018",,"February 27, 2020","St Mark's Hospital, London, Harrow, United Kingdom",,"https://ClinicalTrials.gov/show/NCT03706664"
9,"NCT02492971","Function-oriented Assistive Technology Indexing System Development and Promotion",,"Completed","No Results Available","Multiple Disability",,"user satisfaction (by using System Usability Scale)","Chang Gung Memorial Hospital","All","20 Years to 60 Years   (Adult)",,"175","Other","Observational","Observational Model: Other|Time Perspective: Cross-Sectional","kcheng","September 2016","November 2017","November 2017","July 9, 2015",,"January 25, 2018","Chang Gung Univ., Taoyuan, Taiwan",,"https://ClinicalTrials.gov/show/NCT02492971"
10,"NCT03222375","SQUED™ Series 28.1 Home-use and Treatment of Autowave Reverberator of Autism","SQUED™","Recruiting","No Results Available","Autistic Disorder|Autism Spectrum Disorder|Child Development Disorders, Pervasive|Neurodevelopmental Disorders|Mental Disorders|Asperger's Syndrome|Neurobehavioral Manifestations|Nervous System Diseases","Device: SQUED™ series 28.1 home-use","SQUED™ software of patient","American Federation of Medical Synergetics|Clinic of Synergetics, Department of Neurology/Neuropsychology WOMS|Institute of Medical Synergetics, Department of Cognitive Neurology WOMS|Laboratory of Neurocomputational Active Media WOMS|SQUED, Inc., USA|Center of Synergetics, Universität Stuttgart, Germany|Ivan Franko National University of Lviv, Ukraine|Danylo Halytsky Lviv National Medical University|World Organization of Medical Synergetics|World Autism Center, American Federation of Medical Synergetics","All","1 Month to 21 Years   (Child, Adult)",,"80","Other","Observational","Observational Model: Cohort|Time Perspective: Prospective","SQUED™ series 28.1 home-use","September 26, 2017","September 2022","December 2027","July 19, 2017",,"November 28, 2017","World Autism Center, American Federation of Medical Synergetics, Department of Neurology; Cognitive Neurology/Neuropsychology WOMS, Louisville, Kentucky, United States|Clinic of Synergetics, Department of Neurology; Cognitive Neurology/Neuropsychology of the World Organization of Medical Synergetics, Lviv, Solonka Village, Urozayna Street 41, Ukraine",,"https://ClinicalTrials.gov/show/NCT03222375"
11,"NCT03309787","Health Coaching & Technology in a Weight Loss Center",,"Completed","Has Results","Obesity|Technology|Videoconferencing|mHealth|Behavior, Health","Behavioral: eHealth","Completion Rate: Number of Participants Completing the Intervention|Acceptability|Change in Weight|Change in 6 Minute Walk|Diet Change|Subjective Health|Readiness to Change|Willingness to Pay","Dartmouth-Hitchcock Medical Center","All","18 Years to 65 Years   (Adult, Older Adult)",,"37","Other","Observational","Observational Model: Cohort|Time Perspective: Prospective","D17123","November 29, 2017","October 1, 2018","December 1, 2019","October 16, 2017","July 8, 2020","July 8, 2020","Dartmouth-Hitchcock, Lebanon, New Hampshire, United States","""Study Protocol and Statistical Analysis Plan"", https://ClinicalTrials.gov/ProvidedDocs/87/NCT03309787/Prot_SAP_000.pdf","https://ClinicalTrials.gov/show/NCT03309787"
12,"NCT02781714","Evaluation of an mHealth SMS Dialogue Strategy to Meet Women's and Couples' Postpartum Contraceptive Needs in Kenya","Mobile WACh XY","Completed","No Results Available","Contraception|Postpartum Period","Behavioral: Two-way SMS","Highly-effective contraceptive use|Time to contraceptive use|Dual contraceptive use|Any contraceptive use|Family planning satisfaction questionnaire|Exclusive breastfeeding questionnaire","University of Washington|Kenyatta National Hospital|University of Nairobi","Female","14 Years to 50 Years   (Child, Adult)","Not Applicable","260","Other","Interventional","Allocation: Randomized|Intervention Model: Parallel Assignment|Masking: None (Open Label)|Primary Purpose: Other","51125","July 2016","September 2017","September 2017","May 24, 2016",,"May 3, 2018","Ahero sub-County Hospital, Ahero, Kisumu County, Kenya|Bondo County Hospital, Bondo, Siaya County, Kenya",,"https://ClinicalTrials.gov/show/NCT02781714"
13,"NCT03109366","Electronic Tool for Interaction Between Patients and Health Professionals",,"Completed","No Results Available","Chronic Illness","Behavioral: Online patient-provider communication service","Patterns of intervention use","Oslo University Hospital|University of Oslo|University Hospital of North Norway|Balsfjord Municipality|Marshfield Clinic Research Foundation|Columbia University|Norwegian Centre for Integrated Care and Telemedicine","All","18 Years and older   (Adult, Older Adult)","Not Applicable","20","Other","Interventional","Allocation: N/A|Intervention Model: Single Group Assignment|Masking: None (Open Label)|Primary Purpose: Health Services Research","201512/S10","May 2011","October 2015","October 2015","April 12, 2017",,"April 12, 2017","Oslo University Hospital, Rikshospitalet,, Oslo, Norway",,"https://ClinicalTrials.gov/show/NCT03109366"
14,"NCT00154947","Develop Biomarkers for Assessing RA Joint Erosion",,"Unknown status","No Results Available","Rheumatoid Arthritis",,,"National Taiwan University Hospital|Palo Alto Medical Foundation","All","18 Years to 65 Years   (Adult, Older Adult)",,"60","Other","Observational","Observational Model: Case Control|Primary Purpose: Screening|Time Perspective: Longitudinal|Time Perspective: Prospective","9361700330","May 2004",,"May 2006","September 12, 2005",,"July 20, 2006","Liang-In Lin, Taipei, Taiwan",,"https://ClinicalTrials.gov/show/NCT00154947"
15,"NCT02175823","Health Status Evaluation for Cancer Survivors by Non-intrusive Sensing System",,"Unknown status","No Results Available","Cancer",,"Quality of Life","National Taiwan University Hospital","All","65 Years and older   (Older Adult)",,"40","Other","Observational","Observational Model: Ecologic or Community|Time Perspective: Prospective","201401056RIND","July 2014","July 2015","July 2015","June 26, 2014",,"July 8, 2014","National Taiwan University Hospital, Taipei, Da'an Dist, Taiwan",,"https://ClinicalTrials.gov/show/NCT02175823"
16,"NCT00138073","Effectiveness of a Computer Application in Improving Pulmonary Artery Catheter Waveform Interpretation",,"Terminated","Has Results","Pulmonary Artery Catheter Waveform Interpretation","Device: Web-based waveform interpretation guide","Score on a Computer-based Test on Pulmonary Artery Catheter Waveform Interpretation|Individual and Collective Frequency of Use and Usage Patterns of the Web-based Waveform Interpretation Guide","Massachusetts General Hospital","All","Child, Adult, Older Adult","Not Applicable","55","Other","Interventional","Allocation: Non-Randomized|Intervention Model: Single Group Assignment|Masking: None (Open Label)","2005-P-001381/1; MGH","December 2005","April 2012","April 2012","August 30, 2005","June 30, 2014","June 30, 2014","Massachusetts General Hospital, Boston, Massachusetts, United States",,"https://ClinicalTrials.gov/show/NCT00138073"
17,"NCT01232686","Snow Disease Surveillance System Study","Snow","Completed","No Results Available","Communicable Diseases","Other: Online disease surveillance data access","Earlier diagnosis and treatment for communicable diseases|Earlier detection of local disease outbreaks|Lower number of infected during disease outbreaks|Impact on health service costs","University Hospital of North Norway|University of Tromso|The Royal Norwegian Ministry of Health|Norwegian Health Network (state owned enterprise)","All","Child, Adult, Older Adult","Not Applicable","200","Other","Interventional","Allocation: Non-Randomized|Intervention Model: Parallel Assignment|Masking: None (Open Label)|Primary Purpose: Health Services Research","ID 3746/ HST954-10","October 2010","December 2012","December 2012","November 2, 2010",,"February 16, 2017",,,"https://ClinicalTrials.gov/show/NCT01232686"
18,"NCT01786044","The Impact of a ""Serious Game"" on Improving Patient's Medication Knowledge",,"Completed","No Results Available","Health Knowledge, Attitudes, Practice","Behavioral: MasterMed|Behavioral: Usual Care","medication knowledge|medication adherence","Massachusetts General Hospital","All","18 Years and older   (Adult, Older Adult)","Not Applicable","850","Other","Interventional","Allocation: Randomized|Intervention Model: Parallel Assignment|Masking: Double (Participant, Investigator)|Primary Purpose: Supportive Care","MGH 2012-P-002093/1|PCHI MGH 2012-P-002093/1","March 2014","June 2015","June 2015","February 7, 2013",,"March 22, 2017","Massachusetts General Hospital, Internal Medicine Associates, Boston, Massachusetts, United States",,"https://ClinicalTrials.gov/show/NCT01786044"
19,"NCT03120741","Dementia Patient's Behavior Evaluation Using Noninvasive Ambient Sensor",,"Unknown status","No Results Available","Mild Cognitive Impairment, Dementia",,"The relationship between moving pattern change and dementia.|The relationship between daily routine change and dementia.|The relationship between sleeping time change and dementia.","National Taiwan University Hospital","All","65 Years to 100 Years   (Older Adult)",,"35","Other","Observational","Observational Model: Case-Control|Time Perspective: Other","201608004RINB","May 2017","August 2018","August 2018","April 19, 2017",,"April 19, 2017","National Taiwan University Hospital, Taipei, Taiwan",,"https://ClinicalTrials.gov/show/NCT03120741"
20,"NCT03306082","Image-guided Cochlear Implant Programming (IGCIP)",,"Enrolling by invitation","No Results Available","Cochlear Implant","Other: Image-Guided Cochlear Implant Programming","AzBio Sentence Scores at +5 Signal to Noise Ratio (SNR)|Minimum Speech Test Battery","Vanderbilt University Medical Center|National Institute on Deafness and Other Communication Disorders (NIDCD)","All","18 Years to 90 Years   (Adult, Older Adult)","Not Applicable","150","Other|NIH","Interventional","Allocation: N/A|Intervention Model: Single Group Assignment|Masking: None (Open Label)|Primary Purpose: Treatment","150417|R01DC014037","June 23, 2015","May 2021","May 2022","October 10, 2017",,"January 22, 2020","Vanderbilt University Medical Center, Nashville, Tennessee, United States",,"https://ClinicalTrials.gov/show/NCT03306082"
21,"NCT04320251","Tissue Growth Characterization for Cochlear Implant Users",,"Enrolling by invitation","No Results Available","Cochlear Implant","Procedure: cochlear implant revision surgery","Tissue growth","Vanderbilt University Medical Center","All","18 Years and older   (Adult, Older Adult)","Not Applicable","24","Other","Interventional","Allocation: N/A|Intervention Model: Single Group Assignment|Masking: None (Open Label)|Primary Purpose: Basic Science","192257","June 1, 2020","January 9, 2023","January 9, 2023","March 24, 2020",,"May 5, 2020","Vanderbilt University Medical Center, Nashville, Tennessee, United States",,"https://ClinicalTrials.gov/show/NCT04320251"
22,"NCT04036903","D-Lung: An Analytics Platform for Lung Cancer Based on Deep Learning Technology",,"Recruiting","No Results Available","Lung Cancer","Radiation: computed tomography","accuracy|sensitivity|specificity|area under curve (AUC)|average number of false positives per scan (FPs/scan)|competition performance metric (CPM)","Chinese University of Hong Kong|Department of Computer Science & Engineering, CUHK","All","Child, Adult, Older Adult",,"500","Other","Observational","Observational Model: Case-Only|Time Perspective: Retrospective","2019.316","August 16, 2019","June 2020","December 2021","July 30, 2019",,"October 23, 2019","The Chinese University of Hong Kong, Prince of Wale Hospital, Hong Kong, Shatin, Hong Kong",,"https://ClinicalTrials.gov/show/NCT04036903"
23,"NCT03336411","A Personalized Diet Study to Reduce Glycemic Exposure",,"Recruiting","No Results Available","Pre-diabetes|Overweight and Obesity","Behavioral: mHealth|Behavioral: Personalized mHealth","Body weight, percent change|Body Composition|Metabolic Adaptation|Weight regain","NYU Langone Health|American Heart Association|Weizmann Institute of Science","All","18 Years to 80 Years   (Adult, Older Adult)","Not Applicable","200","Other","Interventional","Allocation: Randomized|Intervention Model: Parallel Assignment|Masking: Double (Participant, Outcomes Assessor)|Primary Purpose: Treatment","17-00741","December 12, 2017","October 2020","May 2021","November 8, 2017",,"May 29, 2020","New York University School of Medicine, New York, New York, United States",,"https://ClinicalTrials.gov/show/NCT03336411"
24,"NCT04322487","Simple, Safe, Same: Lung Ultrasound for COVID-19","LUSCOVID19","Recruiting","No Results Available","Coronavirus|Epidemic Disease|Pneumonia, Viral","Diagnostic Test: Lung ultrasound","Lung ultrasound grading system for COVID-19 pneumonia","Catholic University of the Sacred Heart|Valle del Serchio General Hospital, Lucca, Italy|University of Trento, Trento, Italy|Fondazione IRCCS Policlinico San Matteo, University of Pavia, Pavia, Italy|Bresciamed, Brescia, Italy|118 USL Nordovest Toscana, Lucca, Italy|General Hospital, Voghera, Italy|Lodi General Hospital, Lodi, Italy","All","Child, Adult, Older Adult",,"100","Other","Observational","Observational Model: Case-Only|Time Perspective: Prospective","0013226/20","April 8, 2020","December 31, 2020","January 15, 2021","March 26, 2020",,"April 17, 2020","Bresciamed, Brescia, Italy|Pulmonary Medicine Unit, Lodi General Hospital, Lodi, Italy|118 USL Nordovest Toscana, Lucca, Italy|Diagnostic and Interventional Ultrasound Unit, Valle del Serchio General Hospital, Lucca, Italy|Emergency Department, Fondazione IRCCS Policlinico San Matteo, and Department of Internal Medicine and Therapeutics, University of Pavia, Pavia, Italy|Department of woman and child health and public health, Fondazione Policlinico Universitario A. Gemelli IRCCS, Roma, Italy|Pulmonary Medicine Unit, Dept. Medical and Surgical Sciences, Fondazione Policlinico Universitario A. Gemelli IRCCS, Roma, Italy|Department of Information Engineering and Computer Science, Ultrasound Laboratory Trento, University of Trento, Trento, Italy|Emergency Medicine Unit, General Hospital, Voghera, Italy",,"https://ClinicalTrials.gov/show/NCT04322487"
25,"NCT03266224","Digital Analysis of Ultrasonographic Images in Children With Wry Neck",,"Completed","No Results Available","Torticollis Congenital|Wryneck",,"cervical passive range of motion|Area in cm^2|Brightness of echogenicity in %|max Feret's diameter in cm|min Feret's diameter in cm","Chang Gung Memorial Hospital","All","up to 12 Months   (Child)",,"29","Other","Observational","Observational Model: Case-Only|Time Perspective: Cross-Sectional","100-3793A3","April 30, 2013","August 15, 2015","August 15, 2015","August 30, 2017",,"August 31, 2017",,,"https://ClinicalTrials.gov/show/NCT03266224"
26,"NCT02385643","The Efficacy of A Smartphone-based Support System to Reinforce Alcohol Abstinence in Treatment-seeking Patients",,"Unknown status","No Results Available","Alcohol Dependence","Behavioral: SmartPhone Support System","Time to first lapse|Time to first relapse|Cumulative abstinence days|Number of drinks per drinking days|VAS craving measurement|complete abstinence rate|Drop-out rate","Ming-Chyi Huang|Taipei City Hospital","All","20 Years to 65 Years   (Adult, Older Adult)","Not Applicable","100","Other","Interventional","Allocation: Randomized|Intervention Model: Parallel Assignment|Masking: None (Open Label)|Primary Purpose: Treatment","MOST 103-2628-B-532 -001 -MY3","September 2013","July 2017","July 2017","March 11, 2015",,"March 11, 2015","Ming-Chyi, Taipei, Taiwan",,"https://ClinicalTrials.gov/show/NCT02385643"
27,"NCT04342234","Neural Network to Calculate Morphology of the Cleft Palate to Reduce Cleft Lip and Palate Treatment Burden.",,"Recruiting","No Results Available","Cleft Palate|Orofacial Cleft","Other: data collection of palatal casts and palatal images of cleft patients routinely treated at the institution","3D palatal geometry","University Hospital, Basel, Switzerland|Botnar Research Centre for Child Health (BRCCH)|sciCORE Basel|Department of Computer Science, Computer Graphics Laboratory, ETH Zurich","All","Child, Adult, Older Adult",,"450","Other","Observational","Observational Model: Cohort|Time Perspective: Prospective","2020-00388; ch19Mueller2","March 5, 2020","December 2025","December 2025","April 10, 2020",,"April 15, 2020","Mund-, Kiefer- und Gesichtschirurgie, Universitätsspital Basel, Basel, Switzerland",,"https://ClinicalTrials.gov/show/NCT04342234"
28,"NCT03549806","Stanford Cardiac Invasive Electrophysiology Novel Computer Experience","SCIENCE","Recruiting","No Results Available","Atrial Fibrillation|Atrial Tachycardia|Atrial Flutter|Arrhythmias, Cardiac","Diagnostic Test: No Intervention. Test is computer algorithm.","Reduction in AF burden on follow-up|Freedom from arrhythmia on follow-up|Clinical status as measured by the EQ5D","Stanford University","All","21 Years to 80 Years   (Adult, Older Adult)",,"100","Other","Observational","Observational Model: Cohort|Time Perspective: Prospective","SCIENCE","June 21, 2018","June 30, 2020","June 30, 2021","June 8, 2018",,"September 19, 2019","Stanford Hospital, Stanford, California, United States",,"https://ClinicalTrials.gov/show/NCT03549806"
29,"NCT02404194","Targeted Cognitive Training in Clinical High Risk (CHR) for Psychosis",,"Recruiting","No Results Available","Clinical High Risk for Psychosis","Behavioral: Targeted Cognitive Training|Behavioral: Computer Games","Measurement and Treatment Research to Improve Cognition in Schizophrenia (MATRICS) Consensus Cognitive Battery|Global Function: Social and Role Scales","Rush University Medical Center|Harvard Medical School|Beth Israel Deaconess Medical Center|National Institute of Mental Health (NIMH)","All","15 Years to 30 Years   (Child, Adult)","Not Applicable","76","Other|NIH","Interventional","Allocation: Randomized|Intervention Model: Parallel Assignment|Masking: Triple (Participant, Investigator, Outcomes Assessor)|Primary Purpose: Treatment","MH105246|R01MH105246","March 2015","September 2019",,"March 31, 2015",,"March 19, 2019","Rush University Medical Center, Chicago, Illinois, United States",,"https://ClinicalTrials.gov/show/NCT02404194"
