"Rank","NCT Number","Title","Acronym","Status","Study Results","Conditions","Interventions","Outcome Measures","Sponsor/Collaborators","Gender","Age","Phases","Enrollment","Funded Bys","Study Type","Study Designs","Other IDs","Start Date","Primary Completion Date","Completion Date","First Posted","Results First Posted","Last Update Posted","Locations","Study Documents","URL"
237,"NCT03827187","Awareness Detection and Communication in Disorders of Consciousness",,"Not yet recruiting","No Results Available","Disorder of Consciousness|Paralysis|Motor Neuron Disease|Stroke|Physical Disability","Other: Motor imagery based EEG-BCI","Change in performance accuracy of BCI use pre- and post- training|Change in ability to use imagined movements to consistently communicate yes-no responses to closed questions over multiple sessions by participant with Prolonged Disorder of Consciousness|Diagnostic utility of BCI data provided through study completion to clinicians|Changes in Wessex Head Injury Matrix and Coma Recovery Scale Scores due to potential therapeutic benefit of engaging in motor imagery|Change in performance accuracy as a factor of whether feedback was presented as music or broadband noise,|Changes in performance accuracy as a results of time of day of research experimentation","University of Ulster|National Rehabilitation Hospital, Ireland|St Conal’s Campus Rehabilitation Unit, Letterkenny, Ireland|Belfast Health and Social Care Trust|Western Health and Social Care Trust|South Eastern Health and Social Care Trust|Southern Health and Social Care Trust|Northern Health and Social Care Trust|Barnsley Hospital NHS Foundation Trust|NHS Lothian|Walton Centre NHS Foundation Trust|Hull University Teaching Hospitals NHS Trust|Northern Lincolnshire and Goole Hospitals NHS Foundation Trust|Imperial College Healthcare NHS Trust|Woodland Neuro rehab Center, York (Christchurch Group)|Glenside care, Salisbury|Frenchay Brain Injury Rehabilitation Centre, Bristol|Royal Hospital for Neuro-disability","All","10 Years to 80 Years   (Child, Adult, Older Adult)","Not Applicable","30","Other","Interventional","Allocation: N/A|Intervention Model: Single Group Assignment|Masking: None (Open Label)|Primary Purpose: Basic Science","136640","April 15, 2019","April 15, 2024","April 15, 2024","February 1, 2019",,"March 21, 2019",,,"https://ClinicalTrials.gov/show/NCT03827187"
238,"NCT03197454","Brain Enhancement Training Towards Elders Resilience to Aging","BETTER Aging","Active, not recruiting","No Results Available","Age-related Cognitive Decline","Other: Computerized Plasticity-Based Adaptive Cognitive Training|Other: Commercially available computerized training","Change in performance on global cognitive composite score|Change in performance on processing speed composite score|Change in performance on working memory|Changes in performance on episodic memory|Change in performance on executive function|Change in brain function|Change in brain structure|Change in task-related brain activation|Change in functional performance|Change in Depressive Symptoms","Posit Science Corporation|University of Iowa|The University of Texas at Dallas|National Institute on Aging (NIA)","All","65 Years and older   (Older Adult)","Not Applicable","120","Industry|Other|NIH","Interventional","Allocation: Randomized|Intervention Model: Parallel Assignment|Masking: Quadruple (Participant, Care Provider, Investigator, Outcomes Assessor)|Primary Purpose: Treatment","PSC-0605-17","June 1, 2018","March 1, 2021","April 30, 2021","June 23, 2017",,"April 3, 2020","University of Iowa, Iowa City, Iowa, United States|University of Texas at Dallas, Dallas, Texas, United States",,"https://ClinicalTrials.gov/show/NCT03197454"
239,"NCT01716000","Optical Imaging and User Perception Study of Vaginal Gel",,"Completed","No Results Available","Characterize Gel Distribution in the Vagina|Study Women's Sensory Perceptions and Preferences of Gel","Other: vaginal gel imaging|Behavioral: computer aided self interview","number and frequency of adverse events|extent of vaginal gel coating|uniformity of vaginal gel coating|subject perception and preference of vaginal gel","Duke University|National Institute of Allergy and Infectious Diseases (NIAID)|ImQuest Pharmaceuticals, Inc.|The Miriam Hospital","Female","21 Years to 45 Years   (Adult)","Not Applicable","56","Other|NIH|Industry","Interventional","Allocation: Randomized|Intervention Model: Crossover Assignment|Masking: Single (Participant)|Primary Purpose: Basic Science","Pro00038440|U19AI077289","January 2013","November 2013","November 2013","October 29, 2012",,"July 24, 2014","Duke University Medical Center, Durham, North Carolina, United States",,"https://ClinicalTrials.gov/show/NCT01716000"
240,"NCT03781271","ElectroMagnetic-guided Interstitial Catheter Navigation for Gynecological brachyTherapy","E-MINT","Recruiting","No Results Available","Cervical Cancer","Device: Electromagnetic Navigation","Treatment Plan Target Volume and Organs at Risk Dosimetry","Sunnybrook Health Sciences Centre","Female","Child, Adult, Older Adult","Not Applicable","10","Other","Interventional","Allocation: Non-Randomized|Intervention Model: Crossover Assignment|Masking: None (Open Label)|Primary Purpose: Device Feasibility","143-2018","October 1, 2019","October 2020","February 2021","December 19, 2018",,"March 17, 2020","Sunnybrook Health Sciences Centre, Toronto, Ontario, Canada",,"https://ClinicalTrials.gov/show/NCT03781271"
241,"NCT00577096","Effects of Exercise in Combination With Epoetin Alfa",,"Completed","Has Results","Multiple Myeloma","Drug: Epoetin Alfa|Behavioral: Exercise|Biological: Autologous Peripheral Blood Stem Cell Transplantation|Biological: Red Blood Cell Transfusion|Drug: Thalidomide|Drug: Heparin, Low-Molecular-Weight|Biological: Platelet Transfusion|Drug: Melphalan|Drug: Total Therapy II","Number of Red Blood Cell Transfusions Needed to Maintain Hemoglobin Levels (Short Term)|Number of Red Blood Cell Transfusions Needed to Maintain Hemoglobin Levels (Long Term)|Number of Platelet Transfusions Needed to Maintain Adequate Number of Platelets.(Short Term)|Number of Platelet Transfusions Needed to Maintain Adequate Number of Platelets. (Long Term)|Number of Stem Cell Collection Attempts (Short Term)|Number of Stem Cell Collection Attempts (Long Term)|Total Number of Days of Stem Cell Collection (Short Term)|Total Number of Days of Stem Cell Collection (Long Term)|Hemoglobin Levels Before Chemotherapy and During Transplantation Period (Short Term)|Hemoglobin Levels Before Chemotherapy and During Transplantation Period (Long Term)","University of Arkansas|National Institutes of Health (NIH)|Ortho Biotech Clinical Affairs, L.L.C.","All","Child, Adult, Older Adult","Not Applicable","120","Other|NIH|Industry","Interventional","Allocation: Randomized|Intervention Model: Parallel Assignment|Masking: None (Open Label)|Primary Purpose: Supportive Care","IRB # 29287|R01NR008937|Ortho Biotech Clinical Affairs","October 2001","June 2004","June 2004","December 19, 2007","April 21, 2011","April 6, 2015","University of Arkansas for Medical Sciences, Little Rock, Arkansas, United States",,"https://ClinicalTrials.gov/show/NCT00577096"
242,"NCT02922569","Home-Based, Online, Mindfulness and Cognitive Training for Soldiers and Veterans With TBI","CogMind","Active, not recruiting","No Results Available","Mild Traumatic Brain Injury","Other: Computerized Plasticity-Based Adaptive Cognitive Training|Other: Commercially available computerized training|Other: Mindfulness Training|Other: Traumatic Brain Injury Information Session","Changes in performance on global cognitive composite score|Changes in performance on processing speed composite score|Changes in performance on memory composite score|Changes in performance on executive function composite score|Change in functional performance|Change in TBI functional status|Changes in brain function|Changes in brain structure|Changes in task-related brain activation","Posit Science Corporation|VA Connecticut Healthcare System","All","18 Years and older   (Adult, Older Adult)","Not Applicable","60","Industry|U.S. Fed","Interventional","Allocation: Randomized|Intervention Model: Parallel Assignment|Masking: Quadruple (Participant, Care Provider, Investigator, Outcomes Assessor)|Primary Purpose: Treatment","PSC-0616-16","March 31, 2017","August 30, 2020","September 14, 2020","October 4, 2016",,"April 3, 2020","Veterans Affairs Connecticut Health Care System, West Haven, Connecticut, United States",,"https://ClinicalTrials.gov/show/NCT02922569"
243,"NCT03117478","Brain and Mindfulness","MEDITATION","Recruiting","No Results Available","Healthy","Other: Magneto-encephalography (MEG)|Other: Electro-encephalography (EEG)|Other: Functional Magnetic Resonance Imaging (fMRI)|Other: Anatomical Magnetic Resonance Imaging (aMRI)|Other: Meditation","Anatomical MRI scan|Functional MRI scan|EEG|Behavioral measure : Accuracy of the performed task actions|Psychophysics: Pain threshold|Psychophysiology : Respiration|Subjective experience of the participant|Studies biomarkers of inflammation|Behavioral measure : Speed of the performed task actions|Psychophysiology : Heart|Psychophysiology : Heart rate variability|Psychophysiology : Muscles|Psychophysiology : Eyes|Psychophysiology : Pupillar response|Electrogastrogram","Hospices Civils de Lyon","All","25 Years to 70 Years   (Adult, Older Adult)","Not Applicable","285","Other","Interventional","Allocation: Non-Randomized|Intervention Model: Parallel Assignment|Masking: None (Open Label)|Primary Purpose: Basic Science","69HCL16_0678","March 19, 2016","February 19, 2021","March 19, 2021","April 18, 2017",,"September 8, 2017","Le Vinatier, Bron, France",,"https://ClinicalTrials.gov/show/NCT03117478"
244,"NCT02246426","Treatment of Social Cognition in Schizophrenia Trial","TRuSST","Completed","No Results Available","Schizophrenia","Other: Computerized plasticity-based adaptive cognitive training|Other: Commercially available computerized training","Change in Spatial Cognition (Multiple scores are aggregated to arrive at a single composite score)|Change in Performance on the UCSD Performance-based Skills Assessment (Co-Primary Composite Measure)|Symptoms utilizing the Positive and Negative Syndrome Scale|Psychosocial Functioning utilizing the Global Functioning Scale|Social Functioning utilizing the Social Functioning Scale|Independent Functioning utilizing the Specific Levels of Function|Functional Capacity utilizing Virtual Reality Functional Capacity Assessment|Quality of Life utilizing the Quality of Life Scale|Motivational systems utilizing Behavioral Inhibition/Behavioral Activation Scale|Pleasure utilizing the Temporal Experience of Pleasure Scale|Social Perception utilizing The Awareness of Social Inference Test|Emotion Perception utilizing the Morphed Faces Task|Theory of Mind utilizing the Faux Pas Test|Source Memory utilizing Source Memory Test|Hostility Bias utilizing Ambiguous Intentions Hostility Questionnaire","Posit Science Corporation|National Institute of Mental Health (NIMH)|University of Minnesota|VA Greater Los Angeles Healthcare System|University of California, Los Angeles|Rush University","All","18 Years to 65 Years   (Adult, Older Adult)","Not Applicable","149","Industry|NIH|Other|U.S. Fed","Interventional","Allocation: Randomized|Intervention Model: Parallel Assignment|Masking: Quadruple (Participant, Care Provider, Investigator, Outcomes Assessor)|Primary Purpose: Treatment","PSC-1004-14|R44MH091793","March 2015","August 30, 2018","August 30, 2018","September 22, 2014",,"September 26, 2019","Greater Los Angeles VA, Los Angeles, California, United States|UCLA, Los Angeles, California, United States|Rush University, Chicago, Illinois, United States|University of Minnesota, Minneapolis, Minnesota, United States",,"https://ClinicalTrials.gov/show/NCT02246426"
245,"NCT03696667","Affect Regulation Based on Brain-computer Interface Towards Treatment for Depression",,"Completed","No Results Available","Emotion Regulation","Device: BCI","Emotion regulation questionnaire (ERQ)|Positive and Negative Affect Scale (PANAS)|Brief Assessment of Cognition - Short form|Geriatric Depression Scale (GDS)|Positive Mental Health (PMH) instrument|Body Awareness Questionnaire (BAQ)|Subjective Happiness Scale|Connor-Davidson Resilience Scale 25 (CD-RISC-25)|The Frenchay Activities Index (FAI)|Medical Outcomes Study: 20-item short form survey instrument|Outcome rating scale|Usability questionnaire","Institute of Mental Health, Singapore|Agency for Science, Technology and Research|Duke-NUS Graduate Medical School","All","60 Years to 85 Years   (Adult, Older Adult)","Not Applicable","30","Other","Interventional","Allocation: Randomized|Intervention Model: Parallel Assignment|Masking: None (Open Label)|Primary Purpose: Device Feasibility","2017/00297","March 8, 2018","September 26, 2018","September 26, 2018","October 5, 2018",,"October 5, 2018","Duke-NUS Medical School, Singapore, Singapore|Institute of Mental Health, Singapore, Singapore",,"https://ClinicalTrials.gov/show/NCT03696667"
246,"NCT01387581","Does the Aid of MelaFind Affect Clinical Management Decisions",,"Completed","Has Results","Melanoma",,"Sensitivity|Specificity","MELA Sciences, Inc.","All","Child, Adult, Older Adult",,"227","Industry","Observational","Observational Model: Case Control|Time Perspective: Prospective","20101","October 2011","March 2012","March 2012","July 4, 2011","November 14, 2014","November 14, 2014","MELA Sciences, Irvington, New York, United States",,"https://ClinicalTrials.gov/show/NCT01387581"
247,"NCT02200432","Patient Experience Recommender System for Persuasive Communication Tailoring","PERSPECT","Completed","No Results Available","Smoking Cessation","Other: PERSPeCT Recommender System","message influence","University of Massachusetts, Worcester","All","18 Years and older   (Adult, Older Adult)","Not Applicable","972","Other","Interventional","Allocation: Randomized|Intervention Model: Parallel Assignment|Masking: None (Open Label)|Primary Purpose: Health Services Research","14762","May 2014","March 2015","June 2015","July 25, 2014",,"July 9, 2015","The University of Massachusetts Medical School, Worcester, Massachusetts, United States",,"https://ClinicalTrials.gov/show/NCT02200432"
248,"NCT00033553","Combination Chemotherapy and Computer-Planned Radiation Therapy in Treating Patients With Unresectable Stage III Non-Small Cell Lung Cancer",,"Completed","No Results Available","Lung Cancer","Drug: carboplatin|Drug: gemcitabine hydrochloride|Drug: paclitaxel|Radiation: radiation therapy","Response|Overall Survival|Toxicity","Alliance for Clinical Trials in Oncology|National Cancer Institute (NCI)","All","18 Years and older   (Adult, Older Adult)","Phase 2","69","Other|NIH","Interventional","Allocation: Randomized|Intervention Model: Parallel Assignment|Masking: None (Open Label)|Primary Purpose: Treatment","CALGB-30105|U10CA031946|CDR0000069300","March 2002","September 2006","June 2010","January 27, 2003",,"July 19, 2016","Northeast Alabama Regional Medical Center, Anniston, Alabama, United States|Rebecca and John Moores UCSD Cancer Center, La Jolla, California, United States|Cedars-Sinai Comprehensive Cancer Center at Cedars-Sinai Medical Center, Los Angeles, California, United States|Naval Medical Center - San Diego, San Diego, California, United States|Veterans Affairs Medical Center - San Diego, San Diego, California, United States|UCSF Comprehensive Cancer Center, San Francisco, California, United States|Veterans Affairs Medical Center - San Francisco, San Francisco, California, United States|CCOP - Christiana Care Health Services, Newark, Delaware, United States|Lombardi Cancer Center at Georgetown University Medical Center, Washington, District of Columbia, United States|Walter Reed Army Medical Center, Washington, District of Columbia, United States|Veterans Affairs Medical Center - Washington, DC, Washington, District of Columbia, United States|Broward General Medical Center, Fort Lauderdale, Florida, United States|Memorial Regional Cancer Center at Memorial Regional Hospital, Hollywood, Florida, United States|CCOP - Mount Sinai Medical Center, Miami Beach, Florida, United States|Florida Hospital Cancer Institute, Orlando, Florida, United States|Veterans Affairs Medical Center - Chicago (Westside Hospital), Chicago, Illinois, United States|University of Chicago Cancer Research Center, Chicago, Illinois, United States|Louis A. Weiss Memorial Hospital, Chicago, Illinois, United States|CCOP - Illinois Oncology Research Association, Peoria, Illinois, United States|West Suburban Center for Cancer Care, River Forest, Illinois, United States|Fort Wayne Medical Oncology and Hematology, Incorporated, Fort Wayne, Indiana, United States|CCOP - Northern Indiana CR Consortium, South Bend, Indiana, United States|Holden Comprehensive Cancer Center at University of Iowa, Iowa City, Iowa, United States|Baptist Hospital East - Louisville, Louisville, Kentucky, United States|Dana-Farber/Harvard Cancer Center at Dana Farber Cancer Institute, Boston, Massachusetts, United States|UMASS Memorial Cancer Center - University Campus, Worcester, Massachusetts, United States|Lakeland Cancer Care Center at Lakeland Hospital - St. Joseph, Saint Joseph, Michigan, United States|Veterans Affairs Medical Center - Minneapolis, Minneapolis, Minnesota, United States|University of Minnesota Cancer Center, Minneapolis, Minnesota, United States|Veterans Affairs Medical Center - Columbia (Truman Memorial), Columbia, Missouri, United States|Ellis Fischel Cancer Center at University of Missouri - Columbia, Columbia, Missouri, United States|CCOP - Kansas City, Kansas City, Missouri, United States|Siteman Cancer Center at Barnes-Jewish Hospital, Saint Louis, Missouri, United States|Missouri Baptist Cancer Center, Saint Louis, Missouri, United States|UNMC Eppley Cancer Center at the University of Nebraska Medical Center, Omaha, Nebraska, United States|CCOP - Southern Nevada Cancer Research Foundation, Las Vegas, Nevada, United States|Veterans Affairs Medical Center - Las Vegas, Las Vegas, Nevada, United States|New Hampshire Oncology-Hematology, PA - Hooksett, Hooksett, New Hampshire, United States|Norris Cotton Cancer Center at Dartmouth-Hitchcock Medical Center, Lebanon, New Hampshire, United States|Cancer Institute of New Jersey at the Cooper University Hospital, Camden, New Jersey, United States|Veterans Affairs Medical Center - Buffalo, Buffalo, New York, United States|Roswell Park Cancer Institute, Buffalo, New York, United States|CCOP - Syracuse Hematology-Oncology Associates of Central New York, P.C., East Syracuse, New York, United States|Elmhurst Hospital Center, Elmhurst, New York, United States|Queens Cancer Center of Queens Hospital, Jamaica, New York, United States|CCOP - North Shore University Hospital, Manhasset, New York, United States|North Shore University Hospital, Manhasset, New York, United States|Memorial Sloan-Kettering Cancer Center, New York, New York, United States|New York Weill Cornell Cancer Center at Cornell University, New York, New York, United States|Mount Sinai Medical Center, New York, New York, United States|SUNY Upstate Medical University Hospital, Syracuse, New York, United States|Veterans Affairs Medical Center - Syracuse, Syracuse, New York, United States|Veterans Affairs Medical Center - Asheville, Asheville, North Carolina, United States|Lineberger Comprehensive Cancer Center at University of North Carolina - Chapel Hill, Chapel Hill, North Carolina, United States|NorthEast Oncology Associates - Concord, Concord, North Carolina, United States|Veterans Affairs Medical Center - Durham, Durham, North Carolina, United States|Duke Comprehensive Cancer Center, Durham, North Carolina, United States|Cape Fear Valley Health System, Fayetteville, North Carolina, United States|CCOP - Southeast Cancer Control Consortium, Goldsboro, North Carolina, United States|Lenoir Memorial Cancer Center, Kinston, North Carolina, United States|Comprehensive Cancer Center at Moore Regional Hospital, Pinehurst, North Carolina, United States|Zimmer Cancer Center at New Hanover Regional Medical Center, Wilmington, North Carolina, United States|Comprehensive Cancer Center at Wake Forest University, Winston-Salem, North Carolina, United States|Arthur G. James Cancer Hospital and Solove Research Institute at Ohio State University, Columbus, Ohio, United States|Oklahoma University Medical Center, Oklahoma City, Oklahoma, United States|Western Pennsylvania Hospital, Pittsburgh, Pennsylvania, United States|Lifespan: The Miriam Hospital, Providence, Rhode Island, United States|Veterans Affairs Medical Center - Dallas, Dallas, Texas, United States|Vermont Cancer Center at University of Vermont, Burlington, Vermont, United States|Martha Jefferson Hospital, Charlottesville, Virginia, United States|Virginia Oncology Associates - Norfolk, Norfolk, Virginia, United States|MBCCOP - Massey Cancer Center, Richmond, Virginia, United States|Oncology and Hematology Associates of Southwest Virginia, Incorporated - Roanoke, Roanoke, Virginia, United States|St. Mary's Medical Center, Huntington, West Virginia, United States",,"https://ClinicalTrials.gov/show/NCT00033553"
249,"NCT04026061","Pilot Study Person-centred Tablet Intervention",,"Completed","No Results Available","Dementia|Mobile Applications|Computers|Neurological Rehabilitation|Activities of Daily Living","Behavioral: FMA group|Behavioral: Control group","Self-management abilities people with dementia|Participation in daily and social activities people with dementia|Feeling of competence informal carers|Perceived self-efficacy people with dementia|Perceived autonomy people with dementia|Quality of life people with dementia|Positive care experiences informal carers|Quality of life informal carers","Saxion University of Applied Sciences|University of Twente|Radboud University|VU University Medical Center","All","Child, Adult, Older Adult","Not Applicable","40","Other","Interventional","Allocation: Randomized|Intervention Model: Parallel Assignment|Masking: Single (Investigator)|Primary Purpose: Supportive Care","FindMyApps","October 31, 2017","December 12, 2017","March 22, 2018","July 19, 2019",,"July 19, 2019","Saxion University of applied Sciences, Enschede, Overijssel, Netherlands",,"https://ClinicalTrials.gov/show/NCT04026061"
250,"NCT00630396","Study of a Neuroprotective Drug to Limit the Extent of Damage From an Ischemic Stroke","MINOS","Completed","Has Results","Stroke, Acute","Drug: Minocycline","Maximally Tolerated Dose of IV Minocycline|Half-life of IV Minocycline|90 Day Modified Rankin Scale Score","David Hess, MD|National Institute of Neurological Disorders and Stroke (NINDS)|University of Kentucky|Oregon Health and Science University|Augusta University","All","19 Years and older   (Adult, Older Adult)","Phase 1|Phase 2","60","Other|NIH","Interventional","Allocation: N/A|Intervention Model: Single Group Assignment|Masking: None (Open Label)|Primary Purpose: Treatment","R01NS055728-01A1|07-02-202","May 2008","January 2010","January 2010","March 7, 2008","January 13, 2012","January 13, 2012","University of Kentucky, Lexington, Kentucky, United States|Oregon Health & Science University, Portland, Oregon, United States",,"https://ClinicalTrials.gov/show/NCT00630396"
251,"NCT03221452","Adaptation of a Cognitive Training Intervention for Diabetes Self-Management",,"Unknown status","No Results Available","Cognitive Function Abnormal|Diabetes Mellitus, Type 2","Behavioral: Memory, Attention, and Problem Solving Skills for Diabetes","Change in Diabetes Self-Care Activities|General Self-Efficacy Scale|Multifactorial Memory Questionnaire|Change in executive function|Center for Epidemiologic Studies Depression Scale","University of Texas at Austin","All","40 Years to 70 Years   (Adult, Older Adult)","Not Applicable","29","Other","Interventional","Allocation: N/A|Intervention Model: Single Group Assignment|Masking: None (Open Label)|Primary Purpose: Other","2016-08-0001","September 2, 2016","June 10, 2017","October 2017","July 18, 2017",,"July 18, 2017",,,"https://ClinicalTrials.gov/show/NCT03221452"
252,"NCT01830933","Breast Cancer Risk Reduction: A Patient Doctor Intervention","BreastCARE","Completed","Has Results","Breast Cancer","Other: BreastCARE","Knowledge of Breast Cancer Risk Factors|Percentage of Participants With Correct Perception of Risk|Percentage of Participants Who Had a Discussion of Breast Cancer Risk|Percentage of Participants Who Reported Discussion of Mammography Screening","University of California, San Francisco|Susan G. Komen Breast Cancer Foundation|California Breast Cancer Research Program","All","40 Years to 74 Years   (Adult, Older Adult)","Not Applicable","1235","Other","Interventional","Allocation: Randomized|Intervention Model: Parallel Assignment|Masking: Single (Participant)|Primary Purpose: Prevention","150B-0158","June 2011","August 2012","December 2012","April 12, 2013","May 16, 2013","August 19, 2014","San Francisco General Hospital (SFGH), San Francisco, California, United States|University of California, San Francisco Mt. Zion campus, San Francisco, California, United States",,"https://ClinicalTrials.gov/show/NCT01830933"
