"Rank","NCT Number","Title","Acronym","Status","Study Results","Conditions","Interventions","Outcome Measures","Sponsor/Collaborators","Gender","Age","Phases","Enrollment","Funded Bys","Study Type","Study Designs","Other IDs","Start Date","Primary Completion Date","Completion Date","First Posted","Results First Posted","Last Update Posted","Locations","Study Documents","URL"
440,"NCT02358941","Neurofeedback and Computerized Cognitive Training in Different Settings for Children and Adolescents With ADHD",,"Completed","No Results Available","Attention Deficit Hyperactivity Disorder","Behavioral: Neurofeedback training|Behavioral: Computerized cognitive training","ADHD behavioral symptoms|Neuropsychological performance, EEG parameters","University of Zurich|Swiss National Science Foundation","All","8 Years to 16 Years   (Child)","Not Applicable","102","Other","Interventional","Allocation: Randomized|Intervention Model: Parallel Assignment|Masking: Single (Care Provider)|Primary Purpose: Treatment","SNF: 320030_149411/1","December 2013","March 2017","September 2017","February 9, 2015",,"October 26, 2017","University Clinic of Child and Adolescent Psychiatry, University of Zürich, Zurich, Switzerland",,"https://ClinicalTrials.gov/show/NCT02358941"
441,"NCT02801266","Improving Contraceptive Counseling in the United States","ICC","Completed","No Results Available","New Behavioral Protocol|Treatment as Usual","Behavioral: Evidence informed birth control counseling","Patient satisfaction with counselors as assessed by 5 point Likert rating scales using questionnaire designed for this study at immediate posttest.|Patient satisfaction with counseling session as assessed by 5 point Likert rating scales using a questionnaire designed for this study at immediate posttest.|Patient satisfaction with clinic experience overall as assessed by 5 point Likert rating scales using a questionnaire designed for this study at immediate posttest.|Patient satisfaction with clinic experience overall as assessed by 5 point Likert rating scales using a questionnaire designed for this study at 6 months.|Patient satisfaction with clinic experience overall as assessed by 5 point Likert rating scales using a questionnaire designed for this study at 12 months.|Type of contraceptive method currently using (including none and dual use) as assessed by a questionnaire designed for this study (e.g., what method of birth control are you currently using).","New York University|Planned Parenthood Federation of America","Female","18 Years to 30 Years   (Adult)","Not Applicable","1418","Other","Interventional","Allocation: Randomized|Intervention Model: Parallel Assignment|Masking: Single (Participant)|Primary Purpose: Prevention","FPRPA006057|12-9103","October 2012","October 2014","October 2015","June 15, 2016",,"June 15, 2016","New York University, Silver School of Social Work, New York, New York, United States",,"https://ClinicalTrials.gov/show/NCT02801266"
442,"NCT03400423","The Acute Effects of Caffeine on Exercise and Cognition","AEC","Unknown status","No Results Available","Adult Population","Drug: Caffeine|Behavioral: Moderate Intensity Exercise","3-back on the N-back task|0,1, and 2 back on the N-back task","Western University, Canada","All","18 Years to 64 Years   (Adult)","Phase 4","64","Other","Interventional","Allocation: Randomized|Intervention Model: Crossover Assignment|Masking: None (Open Label)|Primary Purpose: Basic Science","Acute Exercise and Caffeine","February 1, 2018","June 1, 2018","August 1, 2018","January 17, 2018",,"January 17, 2018",,,"https://ClinicalTrials.gov/show/NCT03400423"
443,"NCT04043884","sEmg Biofeedback Training in Individuals With Subacromial Pain Syndrome",,"Not yet recruiting","No Results Available","Shoulder Pain","Other: sEmg biofeedback training|Other: Strength training","Shouder pain|Shoulder function|Root Mean Square (RMS)|The kinematics of the scapula|Peak of muscular torque|Peak torque time|Range of motion","Universidade Federal do Rio Grande do Norte","All","30 Years to 60 Years   (Adult)","Not Applicable","40","Other","Interventional","Allocation: Randomized|Intervention Model: Parallel Assignment|Masking: Single (Outcomes Assessor)|Primary Purpose: Treatment","AKAO2019","August 30, 2019","December 30, 2019","March 30, 2020","August 2, 2019",,"August 7, 2019","Jamilson Simões Brasileiro, Natal, Rio Grande Do Norte, Brazil|Araken kleber Azevedo de Oliveira, Parnamirim, Rio Grande Do Norte, Brazil",,"https://ClinicalTrials.gov/show/NCT04043884"
444,"NCT02277665","Clinical Trial Tobacco Marijuana","RCTTM","Completed","Has Results","Cannabis Use Disorder|Tobacco Use Disorder","Behavioral: CUD Treatment|Behavioral: Tobacco Treatment","Tobacco Quit Attempts|Tobacco Abstinence|Cannabis Abstinence|Weeks of Continuous Cannabis Abstinence|Treatment Attendance|Initiation of Nicotine Replacement Therapy (NRT)","Dartmouth-Hitchcock Medical Center|National Institute on Drug Abuse (NIDA)","All","18 Years and older   (Adult, Older Adult)","Not Applicable","67","Other|NIH","Interventional","Allocation: Randomized|Intervention Model: Parallel Assignment|Masking: None (Open Label)|Primary Purpose: Treatment","STUDY00028307 D14233|5R01DA032243","December 18, 2014","January 18, 2017","January 18, 2017","October 29, 2014","January 8, 2019","January 8, 2019","Geisel School of Medicine at Dartmouth; State Building Site, Concord, New Hampshire, United States|Geisel School of Medicine at Dartmouth; Rivermill Complex Site, Lebanon, New Hampshire, United States|University of Washington School of Social Work, Seattle, Washington, United States","""Study Protocol and Statistical Analysis Plan"", https://ClinicalTrials.gov/ProvidedDocs/65/NCT02277665/Prot_SAP_000.pdf","https://ClinicalTrials.gov/show/NCT02277665"
445,"NCT02884349","The Relationship Between Component Position and RoM",,"Recruiting","No Results Available","Arthropathy of Hip","Procedure: RoM assessment","Actual hip range of movement in degrees measured using clinical movement analysis|Theoretical hip range of movement in degrees calculated from CT scans|On-table hip range of movement in degrees as measured by the operative navigation computer|Combined anteversion in degrees of the acetabular cup and femoral stem system measured from CT scans|Leg length discrepancy|Oxford Hip Score|EQ-5D|Harris Hip Score|Patient satisfaction measured on a five point Likert scale|Number of dislocations in cohort|Number of revisions in cohort|Number of infections in cohort|Operative time in minutes|Blood loss volume|Blood transfusion (Yes/No)","Golden Jubilee National Hospital","All","40 Years to 70 Years   (Adult, Older Adult)","Not Applicable","90","Other","Interventional","Allocation: N/A|Intervention Model: Single Group Assignment|Masking: None (Open Label)|Primary Purpose: Basic Science","Ortho 15-08","October 2016","December 2020","December 2020","August 31, 2016",,"August 1, 2019","Golden Jubilee National Hospital, Clydebank, West Dunbartonshire, United Kingdom",,"https://ClinicalTrials.gov/show/NCT02884349"
446,"NCT02228187","Brain-Computer Interface System for Training Memory and Attention in Elderly",,"Completed","No Results Available","Alzheimer's Disease|Mild Cognitive Impairment|Age-Related Cognitive Decline|Dementia","Device: Brain-Computer Interface","Total Score of the Repeatable Battery for the Assessment of Neuropsychological Status (RBANS)|Sum of Scaled Score of the Rivermead Behavioral Memory Test-II|Number of Adverse Events/Serious Adverse Events Reported|Usability Measure of the Brain-Computer Interface training system","Duke-NUS Graduate Medical School|Agency for Science, Technology and Research|National University, Singapore|Singapore Clinical Research Institute|Singapore General Hospital|Tan Tock Seng Hospital","All","60 Years to 80 Years   (Adult, Older Adult)","Phase 2","240","Other","Interventional","Allocation: Randomized|Intervention Model: Crossover Assignment|Masking: None (Open Label)|Primary Purpose: Prevention","B-14-099","July 2015","June 2017","June 2017","August 28, 2014",,"August 2, 2017","Duke-NUS Medical School, Singapore, Singapore",,"https://ClinicalTrials.gov/show/NCT02228187"
447,"NCT01588301","Self-sampling and Human Papillomavirus (HPV)-Testing for Unscreened Women in Cervical Cancer Prevention","APACHE-2","Completed","No Results Available","Cervical Cancer|Human Papillomavirus Infection","Behavioral: Attending for cervical cytology|Behavioral: Kit for Self-collected vaginal sample","Comparison of women's attitude according to the arm: participation or not to a whole screening action|Analysis in sub-groups|Identification of the psychological determinants and mechanisms (checks and motivational factors)","University Hospital, Tours","Female","30 Years to 65 Years   (Adult, Older Adult)","Early Phase 1","5998","Other","Interventional","Allocation: Randomized|Intervention Model: Parallel Assignment|Masking: Single (Participant)|Primary Purpose: Screening","INCA08-KH / APACHE-2","February 2012","December 2012","December 2012","April 30, 2012",,"September 12, 2014",,,"https://ClinicalTrials.gov/show/NCT01588301"
448,"NCT03706534","Breast Ultrasound Image Reviewed With Assistance of Deep Learning Algorithms",,"Active, not recruiting","No Results Available","Breast Cancer|Breast Lesions|Breast Mass","Device: Ultrasound Image review with CADe|Device: Ultrasound Image review with CADx|Device: Ultrasound Image manual review|Procedure: Biopsy","Concordance rate|Reporting time|Consensus|Accuracy|Sensitivity|Specificity|Area Under Curve","Samsung Medison|University of Rochester","All","19 Years and older   (Adult, Older Adult)","Not Applicable","300","Industry|Other","Interventional","Allocation: Randomized|Intervention Model: Crossover Assignment|Masking: Single (Outcomes Assessor)|Primary Purpose: Device Feasibility","300.08-2018-Samsungmedison-S","September 20, 2018","November 30, 2019","January 31, 2020","October 16, 2018",,"October 29, 2019","University of Rochester, Rochester, New York, United States",,"https://ClinicalTrials.gov/show/NCT03706534"
449,"NCT01665105","Study on the Effect of Electroacupuncture at Both Zusanli and at Both Yanglingquan Acupoints on Cardiovascular Activity",,"Completed","No Results Available","Reaction of Autonomic Nervous System|Reaction of Acupuncture|Reaction of Blood Circulation","Device: acupuncture","From pulse wave, pulse rate variability and skin blood flow to measure cardiovascular activities with electroacupuncture at Zusanli and at Yanglingquan.|From skin blood flow and skin temperature to measure cardiovascular activities with electroacupuncture at Zusanli and at Yanglingquan.","China Medical University Hospital","All","20 Years to 40 Years   (Adult)","Not Applicable","24","Other","Interventional","Allocation: Non-Randomized|Intervention Model: Factorial Assignment|Masking: Single (Participant)|Primary Purpose: Basic Science","DMR101-IRB2-101","July 2012","November 2012","May 2013","August 15, 2012",,"July 12, 2013","China Medical University Hospital, Taichung City, Taiwan",,"https://ClinicalTrials.gov/show/NCT01665105"
450,"NCT02793076","Physical and Emotional Benefits of Group Dance Intervention for Breast Cancer Survivors",,"Completed","No Results Available","Cancer","Other: Bollywood Dance","Change in Body Image Scale (BIS)|Change in Plumbline|Change in Qualitative Open Ended Surveys","University of the Sciences in Philadelphia|Cancer Support Community of Greater Philadelphia","Female","18 Years and older   (Adult, Older Adult)","Not Applicable","12","Other","Interventional","Allocation: N/A|Intervention Model: Single Group Assignment|Masking: None (Open Label)|Primary Purpose: Treatment","840697-4","February 2016","May 2016","May 2016","June 8, 2016",,"June 8, 2016","Cancer Support Community, Philadelphia, Pennsylvania, United States",,"https://ClinicalTrials.gov/show/NCT02793076"
451,"NCT03999450","Preventing Premature Death in Patients With Serious Opioid-related Infection",,"Active, not recruiting","No Results Available","Opioid Use","Behavioral: brief motivational intervention (BMI)|Behavioral: cognitive behavioral therapy","Percentage of participants who completed the week 4 follow up assessments|Percentage of participants who report intervention acceptability|Change in mean readiness|Change in mean self-regulation","University of Rochester|National Center for Advancing Translational Science (NCATS)","All","18 Years and older   (Adult, Older Adult)","Not Applicable","11","Other|NIH","Interventional","Allocation: N/A|Intervention Model: Single Group Assignment|Masking: None (Open Label)|Primary Purpose: Supportive Care","RSRB00003696","October 8, 2019","May 31, 2020","May 31, 2020","June 26, 2019",,"March 31, 2020","University of Rochester Medical Center, Rochester, New York, United States",,"https://ClinicalTrials.gov/show/NCT03999450"
452,"NCT01014026","Self-sampling and Human Papillomavirus (HPV)-Testing for Unscreened Women in Cervical Cancer Prevention","APACHE-1","Completed","No Results Available","Uterine Cervical Neoplasms|Uterine Cervical Dysplasia","Other: Screening test","Concordance between the three HPV tests","University Hospital, Tours","Female","20 Years to 65 Years   (Adult, Older Adult)","Phase 3","734","Other","Interventional","Allocation: Randomized|Intervention Model: Single Group Assignment|Masking: Single (Outcomes Assessor)|Primary Purpose: Diagnostic","INCA08-KH/APACHE-1","September 2009","March 2011","March 2011","November 16, 2009",,"May 13, 2011","IRSA 37, La Riche, France|IRSA 72, Le Mans, France|Service d'Orthogénie, CHRU Tours, Tours, France|Service de Gynécologie, CHRU Tours, Tours, France|Association Paul Metadier, Tours, France",,"https://ClinicalTrials.gov/show/NCT01014026"
453,"NCT03043326","Demonstration Project on the Feasibility to Implement PrEP in MSM and TG Women",,"Recruiting","No Results Available","HIV Prevention","Drug: Tenofovir Disoproxil Fumarate and Emtricitabine","Acceptability, use and adherence of a pre-exposure prophylaxis (PrEP) program using the co-formulation tenofovir disoproxil fumarate 300 mg/emtricitabine 200 mg (TDF/FTC) administered daily by mouth,|Evaluating the deviation of the indication of use of PrEP through self-reporting of its sale or sharing with third parties.|Describing the changes over time in risky sexual behavior among study participants.","Asociación Civil Impacta Salud y Educación, Peru|Gilead Sciences","Male","18 Years and older   (Adult, Older Adult)",,"1000","Other|Industry","Observational","Observational Model: Cohort|Time Perspective: Prospective","PrEP Peru","January 23, 2017","January 31, 2020","January 31, 2022","February 6, 2017",,"July 8, 2019","Asociacion Civil Selva amazonica, Iquitos, Maynas, Peru|Asociacion Via Libre, Lima, Peru|Asociacion Civil Impacta Salud y Educacion- Barranco CRS, Lima, Peru|Epicentro, Lima, Peru|Asociación Civil Impacta Salud y Educación-San Miguel CRS, Lima, Peru",,"https://ClinicalTrials.gov/show/NCT03043326"
454,"NCT04208490","Implementation and Effectiveness Trial of HN-STAR","HN-STAR","Not yet recruiting","No Results Available","Head and Neck Cancer","Other: HN-STAR Intervention","Change in HNC-Specific QOL|Change in QoL|Change symptom burden|Change in symptom burden|Change in pain|Change in patient activation|Change in perceived quality of cancer care|Adherence and surveillance of guideline concordant care","Wake Forest University Health Sciences|National Cancer Institute (NCI)|Memorial Sloan Kettering Cancer Center","All","18 Years and older   (Adult, Older Adult)","Not Applicable","470","Other|NIH","Interventional","Allocation: Randomized|Intervention Model: Parallel Assignment|Masking: None (Open Label)|Primary Purpose: Other","IRB00060694","August 2020","December 2022","December 2022","December 23, 2019",,"May 20, 2020",,,"https://ClinicalTrials.gov/show/NCT04208490"
455,"NCT00349050","Transcranial Magnetic Stimulation (TMS) Effects on Pain Perception",,"Withdrawn","No Results Available","Pain|Trigeminal Neuralgia|Neuropathic Pain","Device: laboratory pain assessment|Procedure: transcranial magnetic stimulation","Clinical neuropathic pain ratings, activity levels, analgesic medication usage, mood ratings, laboratory pain measures (thermal and mechanical pain thresholds, suprathreshold pain ratings, and wind-up pain ratings).","Medical University of South Carolina|National Institute of Neurological Disorders and Stroke (NINDS)","All","21 Years to 60 Years   (Adult)","Phase 2|Phase 3","0","Other|NIH","Interventional","Allocation: Randomized|Intervention Model: Crossover Assignment|Masking: Double (Participant, Investigator)|Primary Purpose: Treatment","K23NS050485-01A2","July 2006","October 2010","October 2010","July 6, 2006",,"April 30, 2012","Brain Stimulation Laboratory, Department of Psychiatry and Behavioral Sciences Medical University of South Carolina 5-North, IOP, 67 President Street, Charleston, South Carolina, United States",,"https://ClinicalTrials.gov/show/NCT00349050"
456,"NCT03868280","Fracture Table vs. Lateral Positioning for Intramedullary Fixation of Femur Fractures","FLiP","Not yet recruiting","No Results Available","Femur Fracture","Procedure: Antegrade femoral nailing Supine Position|Procedure: Antegrade Femoral Nailing Lateral Position","Postoperative femur malrotation|Postoperative femur alignment|Functional gait abnormalities|Walking/Gait ability|Persistent post-surgical Pain (PPSP): 5-point Likert scale|ROM|SF- 12 score (12 Item short Form survey)","Hamilton Health Sciences Corporation","All","18 Years and older   (Adult, Older Adult)","Not Applicable","200","Other","Interventional","Allocation: Randomized|Intervention Model: Parallel Assignment|Masking: Triple (Participant, Investigator, Outcomes Assessor)|Primary Purpose: Treatment","HiREB 5815","June 2019","June 2021","June 2022","March 11, 2019",,"March 12, 2019","McMaster University, Hamilton, Ontario, Canada",,"https://ClinicalTrials.gov/show/NCT03868280"
457,"NCT01929564","Broccoli and Vascular Health Study","BASH","Completed","No Results Available","Cardiovascular Diseases","Other: Beneforte broccoli|Other: Parthenon Broccoli","The primary outcome measure is to assess the change in CVD risk after a 12 week broccoli intervention by assessing the change in concentration of LDL-cholesterol on which the power calculation was based.|To assess the effects of the broccoli intervention clinical biomarkers of CVD. The effect of the intervention on arterial stiffness will also be measured on a sub section of the total cohort (measurements carried out on the Reading cohort).","Quadram Institute Bioscience|Biotechnology and Biological Sciences Research Council|Technology Strategy Board, United Kingdom|Monsanto Company, LLC|University of Reading","All","50 Years and older   (Adult, Older Adult)","Not Applicable","95","Other|Industry","Interventional","Allocation: Randomized|Intervention Model: Parallel Assignment|Masking: Double (Participant, Investigator)|Primary Purpose: Basic Science","IFR01/2012","July 2012","May 2014","May 2014","August 28, 2013",,"July 29, 2014","University of Reading, Reading, Berkshire, United Kingdom|Institute of Food Research, Norwich, Norfolk, United Kingdom",,"https://ClinicalTrials.gov/show/NCT01929564"
458,"NCT02241382","Cologne Cardioversion Study",,"Completed","No Results Available","Atrial Arrhythmia|Heart Failure","Device: Internal Electrocardioversion|Device: External Electrocardioversion","Combined Safety Endpoint|Efficacy Endpoint: restoration of sinus rhythm|Induction of ventricular fibrillation|Lead parameter indicators of impairment|Troponin|Recurrence at follow-up","Universitätsklinikum Köln|Medtronic","All","18 Years to 99 Years   (Adult, Older Adult)","Not Applicable","230","Other|Industry","Interventional","Allocation: Randomized|Intervention Model: Parallel Assignment|Masking: None (Open Label)|Primary Purpose: Treatment","UKK-CCS-2014","September 2014","January 24, 2018","January 24, 2018","September 16, 2014",,"January 26, 2018","Royal Adelaide Hospital, Adelaide, Australia|University Hospital Lübeck, Lübeck, Schleswig-Holstein, Germany|University Hospital Aachen, Aachen, Germany|Heart & Diabetes Center NRW, Bad Oeynhausen, Germany|University Hospital Bonn, Bonn, Germany|Klinikum Coburg GmbH, Coburg, Germany|University Hospital Cologne, Cologne, Germany|Vinzenz Hospital, Cologne, Germany|Krankenhaus Neu-Bethlehem, Göttingen, Germany|University Heart Center Hamburg, Hamburg, Germany|St.Georg Hospital, Hamburg, Germany|Klinikum Leverkusen GmbH, Leverkusen, Germany|Klinikum Oldenburg, Oldenburg, Germany",,"https://ClinicalTrials.gov/show/NCT02241382"
459,"NCT01418703","Feasibility Study of a Modular Control to Range System in Type 1 Diabetes Mellitus","MDB003","Completed","Has Results","Type 1 Diabetes Mellitus","Device: Closed Loop Control (CLC)|Device: Open Loop","Hypoglycemic Events|Percent Time Spent in Near Normoglycemia|Mean Glucose","University of Virginia|Abbott Diabetes Care|Insulet Corporation|DexCom, Inc.|University of California, Santa Barbara","All","21 Years to 65 Years   (Adult, Older Adult)","Not Applicable","38","Other|Industry","Interventional","Allocation: Randomized|Intervention Model: Crossover Assignment|Masking: None (Open Label)|Primary Purpose: Supportive Care","14356","October 2009","December 2010","December 2010","August 17, 2011","November 13, 2014","November 13, 2014","University of Virginia Health System, Charlottesville, Virginia, United States",,"https://ClinicalTrials.gov/show/NCT01418703"
460,"NCT03344328","Prevalence, Intensity and Consequences of Bortezomib-induced Neuropathic Disorders.","PREVIB","Recruiting","No Results Available","Chemotherapy Induced Peripheral Neuropathy|Multiple Myeloma","Drug: Bortezomib","Prevalence of peripheral neuropathy|Chronic pain|Screening of neuropathic pain|Anxiety and Depression Score|Hearing disorders|Health -related quality of life related to chemotherapy treatment.","University Hospital, Clermont-Ferrand","All","18 Years and older   (Adult, Older Adult)",,"360","Other","Observational","Observational Model: Cohort|Time Perspective: Retrospective","CHU-359","January 15, 2019","December 31, 2019","January 31, 2020","November 17, 2017",,"July 1, 2019","CHU Clermont-Ferrand, Clermont-Ferrand, France",,"https://ClinicalTrials.gov/show/NCT03344328"
461,"NCT03527550","Cognitive Control Training for Urgency in a Naturalistic Clinical Setting",,"Enrolling by invitation","No Results Available","Impulsive Behavior|Mental Disorders","Other: Cognitive Control Training","Change in Average Score on Negative Urgency Scale (4 items from the Short UPPS-P Impulsive Behavior Scale)|Change in Average Score on the Positive Urgency Scale (4 Items from the Short UPPS-P Impulsive Behavior Scale).|Change in estimated Stop-Signal Reaction Time (SSRT) on Stop-Signal Task (ms)|Feasibility of assessing change in event-related potentials (ERPs) during a Stop-Signal Task in a partial hospital population|Completion Rates|Average Perceived Helpfulness of Training","Mclean Hospital|National Institute of Mental Health (NIMH)","All","18 Years and older   (Adult, Older Adult)","Not Applicable","90","Other|NIH","Interventional","Allocation: Randomized|Intervention Model: Parallel Assignment|Masking: None (Open Label)|Primary Purpose: Basic Science","2017P001550|1F32MH115530","September 11, 2018","February 2021","February 2021","May 17, 2018",,"December 6, 2019","McLean Hospital, Belmont, Massachusetts, United States",,"https://ClinicalTrials.gov/show/NCT03527550"
462,"NCT03512782","Post-discharge Monitoring of Patients With Heart Failure","CARDIOENF","Not yet recruiting","No Results Available","Heart Failure","Other: CARDIOENF","hospital readmission|signs and symptoms of decompensation of heart failure","Instituto de Cardiologia do Rio Grande do Sul|Fundação de Amparo à Pesquisa do Estado do Rio Grande do Sul, Brazil|Irmandade Santa Casa de Misericórdia de Porto Alegre","All","18 Years and older   (Adult, Older Adult)","Not Applicable","142","Other","Interventional","Allocation: Randomized|Intervention Model: Parallel Assignment|Masking: Single (Outcomes Assessor)|Primary Purpose: Health Services Research","5085_15","September 1, 2018","March 30, 2019","April 30, 2019","May 1, 2018",,"September 5, 2018","Universidade Federal de Ciências da Saúde de Porto Alegre (UFCSPA), Porto Alegre, Rio Grande Do Sul, Brazil",,"https://ClinicalTrials.gov/show/NCT03512782"
463,"NCT03459651","Effect of Turner Syndrome on Number Sense",,"Not yet recruiting","No Results Available","Turner Syndrome","Behavioral: ANS training","Single and multiple-operand addition and subtraction accuracy|Single and multiple-operand addition and subtraction response time","Stanford University","Female","6 Years to 40 Years   (Child, Adult)","Not Applicable","250","Other","Interventional","Allocation: N/A|Intervention Model: Single Group Assignment|Masking: None (Open Label)|Primary Purpose: Treatment","092883","August 2020","March 31, 2023","March 31, 2023","March 9, 2018",,"September 18, 2019","Center for Interdisciplinary Brain Sciences Research, Stanford, California, United States",,"https://ClinicalTrials.gov/show/NCT03459651"
