"Rank","NCT Number","Title","Acronym","Status","Study Results","Conditions","Interventions","Outcome Measures","Sponsor/Collaborators","Gender","Age","Phases","Enrollment","Funded Bys","Study Type","Study Designs","Other IDs","Start Date","Primary Completion Date","Completion Date","First Posted","Results First Posted","Last Update Posted","Locations","Study Documents","URL"
638,"NCT00955110","Study to Compare Oxymorphone Extended-Release (Opana ER) Versus Oxycodone Controlled-Release (Oxycontin)",,"Completed","Has Results","Healthy","Drug: Oxymorphone ER|Drug: Oxycodone CR|Drug: Placebo|Drug: Hydromorphone","High VAS - Emax (mm)","Endo Pharmaceuticals|Kendle Early Stage - Toronto","All","18 Years to 55 Years   (Adult)","Phase 4","78","Industry|Other","Interventional","Allocation: Randomized|Intervention Model: Crossover Assignment|Masking: Quadruple (Participant, Care Provider, Investigator, Outcomes Assessor)|Primary Purpose: Basic Science","EN3202-402","June 2009","September 2009","September 2009","August 7, 2009","July 14, 2011","October 5, 2017","Toronto, Ontario, Canada",,"https://ClinicalTrials.gov/show/NCT00955110"
639,"NCT03396549","Effect of tDCS Montage on Measures of Appetite",,"Completed","No Results Available","Eating Behavior","Device: new sham tDCS|Device: real tDCS","Eating Behaviors|Detection of target from sham tDCS session.","University of Alabama at Birmingham","All","18 Years to 55 Years   (Adult)","Not Applicable","28","Other","Interventional","Allocation: Randomized|Intervention Model: Single Group Assignment|Masking: Double (Participant, Outcomes Assessor)|Primary Purpose: Basic Science","IRB-300000049","March 7, 2018","March 14, 2018","March 14, 2018","January 11, 2018",,"May 15, 2018","University of Alabama at Birmingham (UAB), Birmingham, Alabama, United States",,"https://ClinicalTrials.gov/show/NCT03396549"
640,"NCT02051530","Mood, Serotonin and Social Interaction",,"Completed","No Results Available","Mood|Social Behavior","Dietary Supplement: tryptophan depletion","Empathic Accuracy|Behavioral mimicry|Emotional Prosody (EP)|blood|heart rate variability","University of Groningen","All","18 Years to 65 Years   (Adult, Older Adult)","Early Phase 1","40","Other","Interventional","Allocation: Randomized|Intervention Model: Crossover Assignment|Masking: Double (Participant, Investigator)|Primary Purpose: Basic Science","NL451-09-013","April 2012","March 2014","March 2014","January 31, 2014",,"January 30, 2015","University Center Psychiatry, Groningen, Netherlands",,"https://ClinicalTrials.gov/show/NCT02051530"
641,"NCT02533076","The Functional Consequences of the CTNS-deletion for the TRPV1-receptor in Cystinosis Patients",,"Completed","No Results Available","Cystinosis","Other: Challenge agent: capsaicin|Other: Challenge agent: placebo|Device: Mechanical stimulation with Von Frey filaments|Device: Temperature sensitivity measurement with Advanced Thermal Stimulation","Change from baseline of the dermal blood flow response to topical applied capsaicin at 10, 20, 30, 40, 50 and 60 minutes, measured with Laser Doppler Imaging and expressed in % change to baseline|Change from baseline of the skin sensitivity response after topical applied capsaicin at 10, 20, 30, 40, 50 and 60 minutes, measured with the Numerical rating scale and skin sensitivity to mechanical stimulation, measured with Von Frey filaments.|Temperature sensitivity (detection and pain threshold), measured with Advanced Thermal stimulation and expressed in degrees Celsius.","Universitaire Ziekenhuizen Leuven","All","8 Years and older   (Child, Adult, Older Adult)","Early Phase 1","50","Other","Interventional","Allocation: Non-Randomized|Intervention Model: Parallel Assignment|Masking: None (Open Label)|Primary Purpose: Basic Science","CCP13-3302-CYST","November 2014","July 2015","July 2015","August 26, 2015",,"August 26, 2015","Centre for Clinical Pharmacology, UZ Leuven, Leuven, Vlaams-Brabant, Belgium",,"https://ClinicalTrials.gov/show/NCT02533076"
642,"NCT04041024","Decision-making and Risk-taking in Bulimia","FaciB","Not yet recruiting","No Results Available","Bulimia Nervosa","Other: tasks and questionnaires","oxygen variation in the brain|Task related parameters|Skin conductance response related to events in the task performed while the signal is being collected|cardiac frequency in beats per minute related to events in the task performed while the signal is being collected|parameters of eye movements extracted from the eye tracking signal is being collected|Eating Disorders Examination (EDE-Q)","Hôpital le Vinatier","All","18 Years to 35 Years   (Adult)","Not Applicable","720","Other","Interventional","Allocation: Non-Randomized|Intervention Model: Parallel Assignment|Masking: None (Open Label)|Primary Purpose: Basic Science","2018-A01268-47","September 2020","January 2024","January 2025","August 1, 2019",,"June 17, 2020",,,"https://ClinicalTrials.gov/show/NCT04041024"
643,"NCT03451409","Neurobiology of Sensory Phenomena in Obsessive-Compulsive Disorder",,"Recruiting","No Results Available","Obsessive Compulsive Disorder","Other: Tasked based functional MRI (fMRI)|Other: Eye Tracking Device","Brain activation in relation to sensory phenomena severity in patients with OCD","NYU Langone Health","All","18 Years to 60 Years   (Adult)","Not Applicable","100","Other","Interventional","Allocation: Non-Randomized|Intervention Model: Parallel Assignment|Masking: None (Open Label)|Primary Purpose: Basic Science","17-01606","May 5, 2018","January 2022","January 2022","March 1, 2018",,"April 24, 2020","New York University School of Medicine, New York, New York, United States",,"https://ClinicalTrials.gov/show/NCT03451409"
644,"NCT02816632","Feedbacks' Influence on Decision Making Processes","Feedbacks","Recruiting","No Results Available","Healthy Volunteers","Other: mRI|Other: Effect of Galvanic Vestibular Stimulation on decision making processes","Behavioral performance (Accuracy)|Behavioral performance (Reaction times)|Neural activity (BOLD signal measured using fMRI) as a function of the nature of the feedback.","Hospices Civils de Lyon","All","18 Years to 45 Years   (Adult)","Not Applicable","180","Other","Interventional","Allocation: N/A|Intervention Model: Single Group Assignment|Masking: None (Open Label)|Primary Purpose: Basic Science","69HCL15_0221|2015-A00623-46","March 30, 2017","March 30, 2023","March 30, 2023","June 28, 2016",,"April 3, 2019","Unité de Neuro-Ophtalmologie Hôpital Neurologique - HOSPICES CIVILS DE LYON, Bron, France",,"https://ClinicalTrials.gov/show/NCT02816632"
645,"NCT04359108","Environmental Localization Mapping and Guidance for Visual Prosthesis Users","SLAM","Not yet recruiting","No Results Available","Retinitis Pigmentosa|Visual Impairment|Visual Prosthesis","Device: Navigation System for Users of a Visual Prosthesis","Accuracy as assessed as ratio of target identification success to total trials|Trial Time as assessed by mean time duration to identify target|Success in psychophysical judgments","Johns Hopkins University|Carnegie Mellon University|National Eye Institute (NEI)","All","20 Years to 70 Years   (Adult, Older Adult)","Not Applicable","35","Other|NIH","Interventional","Allocation: N/A|Intervention Model: Single Group Assignment|Masking: None (Open Label)|Primary Purpose: Basic Science","IRB00228932|1R01EY029741-01A1","July 1, 2020","September 30, 2023","September 30, 2023","April 24, 2020",,"June 23, 2020","Johns Hopkins Medicine - Wilmer Eye Institute, Baltimore, Maryland, United States|Johns Hopkins Applied Physics Laboratory, Laurel, Maryland, United States",,"https://ClinicalTrials.gov/show/NCT04359108"
646,"NCT00373399","Effects of Smoked Marijuana on Risk Taking and Decision Making Tasks",,"Completed","Has Results","Marijuana Use Disorder","Drug: Inactive Marijuana (0% THC)|Drug: Low THC marijuana (1.8 %THC)|Drug: High THC marijuana (3.9% THC)","Change From Baseline in Iowa Gambling Task Scores [Objective Measure of Decision Making]","New York State Psychiatric Institute|National Institute on Drug Abuse (NIDA)","All","21 Years to 45 Years   (Adult)","Phase 1","36","Other|NIH","Interventional","Allocation: Randomized|Intervention Model: Crossover Assignment|Masking: Double (Participant, Investigator)|Primary Purpose: Basic Science","IRB# 5204|DA-03746","May 2006","March 2008","March 2008","September 8, 2006","October 31, 2018","December 19, 2018","New York State Psychiatric Institute, New York, New York, United States",,"https://ClinicalTrials.gov/show/NCT00373399"
647,"NCT03633955","Pilot Imaging Study of Leukemia","REALIZE","Not yet recruiting","No Results Available","Acute Lymphocytic Leukemia|Acute Myeloid Leukemia|Ambiguous Lineage Leukemia or Lymphoma|Myelodysplastic Syndrome","Drug: FLT","FLT SUV identifies leukemia disease|Computer assisted evaluation of leukemia disease|Patient reported outcomes|Blood biomarkers","University of Oklahoma|Emory University","All","4 Years to 80 Years   (Child, Adult, Older Adult)","Phase 1","36","Other","Interventional","Allocation: Non-Randomized|Intervention Model: Parallel Assignment|Masking: None (Open Label)|Primary Purpose: Diagnostic","OU-SCC-REALIZE","July 2020","April 2022","May 2024","August 16, 2018",,"June 16, 2020","Children's National Health System, Washington, District of Columbia, United States|Emory University, Atlanta, Georgia, United States|University of Oklahoma Health Sciences Center, Oklahoma City, Oklahoma, United States",,"https://ClinicalTrials.gov/show/NCT03633955"
648,"NCT04196153","A Comparison of Pedicle Screws Placement Accuracy in Thoracolumbar Spine Using Two Guidance Techniques Which Are O-arm Navigation and Standard Cervical Distractor Screws",,"Recruiting","No Results Available","Pedicle Screws|Surgery, Computer-Assisted/Adverse Effects|Bone Screws|Imaging, Three-Dimensional/Methods","Procedure: Pedicle screws instrumentation","Rate screws breach|Screw insertion time|screws revision times|degree of screws breach|Direction of the breach|complications","King Abdullah International Medical Research Center","All","18 Years and older   (Adult, Older Adult)","Not Applicable","60","Other","Interventional","Allocation: Randomized|Intervention Model: Parallel Assignment|Masking: Single (Outcomes Assessor)|Primary Purpose: Treatment","kashabmo","October 10, 2019","May 2020","July 2020","December 12, 2019",,"December 12, 2019","King Abdulaziz Medical City, Jeddah, Eastern Province, Saudi Arabia",,"https://ClinicalTrials.gov/show/NCT04196153"
649,"NCT01376869","Investigation of the Acute Cognitive, Mood and Autonomic Effects of Hops in Healthy Participants",,"Completed","No Results Available","Mood Modulation|Modulation of Cognition","Dietary Supplement: Hops Extract|Other: Placebo (silica)","Mood|Satiety|Bioavailability of Hops|Cognition","Northumbria University|The New Zealand Institute for Plant and Food Research","All","18 Years to 35 Years   (Adult)","Not Applicable","150","Other","Interventional","Allocation: Randomized|Intervention Model: Parallel Assignment|Masking: Triple (Participant, Investigator, Outcomes Assessor)|Primary Purpose: Basic Science","21AO1","June 2011","December 2011","December 2011","June 20, 2011",,"June 25, 2012","Northumbria University, Newcastle upon Tyne, United Kingdom",,"https://ClinicalTrials.gov/show/NCT01376869"
650,"NCT02193854","Teledermatology Solution Through Mobile Phone in Rural Mongolia",,"Completed","No Results Available","Social Distance","Device: Mobile Phone","Comparison between the number of referrals in the control and intervention groups|Satisfaction by physicians and patients by questionnaire","Taipei Medical University|Health Science University of Mongolia","All","18 Years and older   (Adult, Older Adult)","Not Applicable","441","Other","Interventional","Allocation: N/A|Intervention Model: Single Group Assignment|Masking: None (Open Label)|Primary Purpose: Health Services Research","TaipeiMU","September 2013","January 2014","January 2014","July 18, 2014",,"July 18, 2014","Shabbir Syed Abdul, Taipei, Taiwan",,"https://ClinicalTrials.gov/show/NCT02193854"
651,"NCT01823146","Oxytocin's Effect on Socioemotional Aging",,"Completed","Has Results","Aging","Drug: Oxytocin spray|Drug: Placebo spray","Extent of Trust Behavior|Meta-Mood|Functional Connectivity (Resting fMRI)","University of Florida","All","18 Years to 85 Years   (Adult, Older Adult)","Not Applicable","106","Other","Interventional","Allocation: Randomized|Intervention Model: Parallel Assignment|Masking: Double (Participant, Investigator)|Primary Purpose: Basic Science","39-2013|UL1TR000064","July 2013","September 2014","September 2014","April 4, 2013","September 17, 2015","August 25, 2016","University of Florida, Gainesville, Florida, United States",,"https://ClinicalTrials.gov/show/NCT01823146"
652,"NCT02965924","Effect of Topical Phenylephrine 2.5% on EVP in Normal Human Eyes",,"Completed","Has Results","Assess Phenylephrine on EVP and IOP","Drug: Phenylephrine 2.5%","Change in Episcleral Venous Pressure (EVP)|Change in Intraocular Pressure (IOP)","Mayo Clinic","All","18 Years and older   (Adult, Older Adult)","Not Applicable","20","Other","Interventional","Allocation: N/A|Intervention Model: Single Group Assignment|Masking: None (Open Label)|Primary Purpose: Basic Science","16-007077","October 2016","October 1, 2018","October 1, 2018","November 17, 2016","October 23, 2019","October 23, 2019","Mayo Clinic in Rochester, Rochester, Minnesota, United States","""Study Protocol and Statistical Analysis Plan"", https://ClinicalTrials.gov/ProvidedDocs/24/NCT02965924/Prot_SAP_000.pdf","https://ClinicalTrials.gov/show/NCT02965924"
653,"NCT03101826","Optimizing the Social Engagement System in Prader-Willi Syndrome: Insights From the Polyvagal Theory",,"Recruiting","No Results Available","Prader-Willi Syndrome","Behavioral: Listening Project Protocol","Effect of Intervention on Autonomic regulation|Effect of Intervention on Heart period|Effect of Intervention on Auditory processing|Effect of Intervention on Sensory Sensitivities|Effect of Intervention on Latency to Affect recognition|Effect of Intervention on Accuracy of Affect recognition|Effect of Intervention on Prosody|Effect of Intervention on Disruptive Behavior|Effect of Intervention on Social behavior|Effect of Intervention on Oxytocin|Effect of Intervention on Vasopressin","Indiana University|Latham Centers","All","13 Years to 25 Years   (Child, Adult)","Not Applicable","25","Other","Interventional","Allocation: N/A|Intervention Model: Single Group Assignment|Masking: None (Open Label)|Primary Purpose: Basic Science","1609337519","November 1, 2017","May 2020","May 2020","April 5, 2017",,"February 27, 2019","Latham Centers School, Brewster, Massachusetts, United States",,"https://ClinicalTrials.gov/show/NCT03101826"
654,"NCT03472729","AGE-ON 2.0: Expanding and Evaluating a Tablet Training Program for Older Adults","AGEON2","Completed","No Results Available","Social Isolation","Other: AGE-ON Workshop","Duke Social Support Index|de Jon Gierveld Loneliness Scale|CASP-12","McMaster University|Social Sciences and Humanities Research Council of Canada","All","60 Years and older   (Adult, Older Adult)","Not Applicable","32","Other","Interventional","Allocation: Randomized|Intervention Model: Parallel Assignment|Masking: Double (Investigator, Outcomes Assessor)|Primary Purpose: Other","3670","September 1, 2018","September 1, 2019","January 1, 2020","March 21, 2018",,"February 20, 2020","McMaster University, Hamilton, Ontario, Canada",,"https://ClinicalTrials.gov/show/NCT03472729"
655,"NCT03958474","Neurobehavioral Mechanisms of Choice in Opioid Use Disorder",,"Recruiting","No Results Available","Opioid Use Disorder","Drug: Oxycodone","Gambling task","Joshua A. Lile, Ph.D.|University of Kentucky","All","18 Years to 50 Years   (Adult)","Early Phase 1","31","Other","Interventional","Allocation: Randomized|Intervention Model: Crossover Assignment|Masking: Double (Participant, Outcomes Assessor)|Primary Purpose: Basic Science","47844","August 16, 2019","June 30, 2023","June 30, 2023","May 22, 2019",,"August 19, 2019","Laboratory of Human Behavioral Pharmacology, Lexington, Kentucky, United States",,"https://ClinicalTrials.gov/show/NCT03958474"
656,"NCT01174485","Effects of Liposuction and Exercise Training on Metabolism, Lipid Profile and Adiposity in Women",,"Completed","No Results Available","Healthy Subjects","Procedure: exercise","Body composition|Insulin Sensitivity|Total cholesterol, LDL-c, HDL-c, VLDL-c and triacylglycerol plasma levels|Cytokine plasma levels - IL-6, TNF-alpha, IL-10, leptin and adiponectin levels","University of Sao Paulo","Female","20 Years to 36 Years   (Adult)","Early Phase 1","40","Other","Interventional","Allocation: Randomized|Intervention Model: Parallel Assignment|Masking: None (Open Label)|Primary Purpose: Basic Science","EEFEUSP-LIPO","August 2010","April 2011","April 2011","August 3, 2010",,"May 13, 2011","Escola de Educação Física e Esporte da Universidade de São Paulo, São Paulo, SP, Brazil",,"https://ClinicalTrials.gov/show/NCT01174485"
657,"NCT02514226","Evaluation of Periodontal Treatment in Patients With Bronchiectasis",,"Enrolling by invitation","No Results Available","Bronchiectasis|Periodontal Disease","Procedure: supragingival treatment|Procedure: periodontal treatment|Procedure: periodontal treatment and photodynamic therapy|Other: dental hygiene orientation","Microbiological evaluation|Halitosis measurements","University of Nove de Julho|InCor Heart Institute|University of Sao Paulo|Fundação de Amparo à Pesquisa do Estado de São Paulo (FAPESP #2015/20535-1)","All","35 Years and older   (Adult, Older Adult)","Not Applicable","90","Other","Interventional","Allocation: Randomized|Intervention Model: Parallel Assignment|Masking: Triple (Participant, Investigator, Outcomes Assessor)|Primary Purpose: Treatment","44769315.0.0000.5511","August 2015","July 2020","December 2020","August 3, 2015",,"July 10, 2018","InCor Heart Institute, Sao Paulo, São Paulo, Brazil",,"https://ClinicalTrials.gov/show/NCT02514226"
658,"NCT04377061","Anemia in Non-celiac Wheat Sensitivity",,"Recruiting","No Results Available","Non-celiac Gluten Sensitivity|Anemia","Diagnostic Test: Evaluation of anemia","Presence, severity and morphologic characteristic of anemia|Possible pathogenic mechanisms","University of Palermo","All","18 Years to 65 Years   (Adult, Older Adult)",,"100","Other","Observational","Observational Model: Case-Control|Time Perspective: Prospective","ACPM25","January 1, 2020","January 1, 2021","January 1, 2022","May 6, 2020",,"May 7, 2020","Department of Internal Medicine, Giovanni Paolo II Hospital of Sciacca, Sciacca, Agrigento, Italy|Internal Medicine Division of the ""Cervello-Villa Sofia"" Hospital, Palermo, PA, Italy|Department of Internal Medicine, University Hospital of Palermo, Palermo, Italy",,"https://ClinicalTrials.gov/show/NCT04377061"
659,"NCT03213600","Neurostimulation-enhanced Behavioral Remediation of Social Cognition in Schizophrenia","NSOCOG","Withdrawn","No Results Available","Behaviors and Mental Disorders","Device: transcranial Direct Current Stimulation tDCS","Causation Task - testing time based causal judgments|Triangle Task - measuring the extent to which temporal coincidence is used to infer causality in a social situation|EEG Task 1, Time visual oddball task - for measuring electrophysiological markers of active temporal (time) deviance detection|EEG Task 2, Covert visual simultaneity task - an exploratory task designed to model the visual Simultaneity behavioral task|Resting state oscillatory structure","Hôpital le Vinatier","All","18 Years to 45 Years   (Adult)","Not Applicable","0","Other","Interventional","Allocation: Randomized|Intervention Model: Parallel Assignment|Masking: Quadruple (Participant, Care Provider, Investigator, Outcomes Assessor)|Primary Purpose: Basic Science","2017-A01042-51","November 1, 2018","September 1, 2019","December 31, 2019","July 11, 2017",,"April 22, 2019","Hopital Le Vinatier, Bron, France",,"https://ClinicalTrials.gov/show/NCT03213600"
660,"NCT02769143","Effects of Whole Body Vibration and Pilates on Bone Mineral Density in Postmenopausal Women",,"Completed","No Results Available","Bone Mineral Density Quantitative Trait Locus 3","Other: Whole-Body Vibration|Other: Pilates","Bone mineral density|Muscle strength|Flexibility|Postural balance|The Timed Up and Go test (TUG)|Fear Falls|Quality of life","Universidade Norte do Paraná","Female","40 Years to 75 Years   (Adult, Older Adult)","Not Applicable","51","Other","Interventional","Allocation: Randomized|Intervention Model: Parallel Assignment|Masking: Single (Outcomes Assessor)|Primary Purpose: Treatment","1.032.182","May 2016","November 2016","December 2016","May 11, 2016",,"November 6, 2017","Universidade Norte do Paraná, Londrina, Paraná, Brazil",,"https://ClinicalTrials.gov/show/NCT02769143"
661,"NCT04208425","Promoting Resilience in Teens With ASD","PRITA","Recruiting","No Results Available","Autism Spectrum Disorder","Behavioral: Project Personality|Behavioral: Sharing Feelings Intervention","Children's Depression Inventory-2 (CDI-2)|Behavior Rating Inventory of Executive Function, Second Edition (BRIEF-2)|Brief Symptom Inventory 18 (BSI-18)|Multidimensional Anxiety Scale for Children-2 (MASC-2)|Primary Control Scale for Children (PCSC)|Secondary Control Scale for Children (SCSC)|Social Responsiveness Scale-2 (SRS-2)|The Self Perception Profile for Children/ Adolescents (SPPC/A) self-report|Implicit Personality Theory Questionnaire (ITPQ)","Stony Brook University|Society of Clinical Child & Adolescent Psychology|Autism Research Institute","All","11 Years to 16 Years   (Child)","Not Applicable","40","Other","Interventional","Allocation: Randomized|Intervention Model: Parallel Assignment|Masking: Double (Participant, Investigator)|Primary Purpose: Treatment","IRB2019-00280|AWD00001042|AWD00001244","January 7, 2019","December 2021","March 2022","December 23, 2019",,"March 18, 2020","Stony Brook University, Stony Brook, New York, United States",,"https://ClinicalTrials.gov/show/NCT04208425"
662,"NCT01785121","Increasing Exercise Capacity of Patients With Heart Failure by Wii Gaming","HF-Wii","Completed","No Results Available","Heart Failure","Behavioral: Structured access to a Wii game computer (Wii)|Behavioral: Motivational support only","change in 6 minute walk test|Muscle function|Exercise Motivation|Daily Physical Activity|Exercise Self-Efficacy|Perceived Physical Effort|Heart Failure Symptoms|Health Related Quality of Life|Global Well-Being|Readmission|Costs|Experiences of patients|change in 6 minute walk","Linkoeping University|The Swedish Research Council|The Swedish Heart and Lung Association|Swedish Heart Lung Foundation|Vardalinstitutet The Swedish Institute for Health Sciences|Medical Research Council of Southeast Sweden|Swedish National Science Council/Swedish research council for health, working life and welfare","All","18 Years and older   (Adult, Older Adult)","Not Applicable","605","Other","Interventional","Allocation: Randomized|Intervention Model: Parallel Assignment|Masking: Double (Investigator, Outcomes Assessor)|Primary Purpose: Treatment","HF-Wii","September 2013","April 2018","April 2018","February 7, 2013",,"April 3, 2019","University of California, Irvine, California, United States|Center of Internal Medicine Elsterwerda, Elsterwerda, Germany|Rabin Medical Center, Petah Tikva, Israel|Villa delle Querce hospital, Nemi, Italy|Maastricht University Medical Center, Maastricht, Netherlands|Länssjukhuset Ryhov hospital, Jönköping, Sweden|University hospital Linköping, Linköping, Sweden|Vrinnevi Hospital, Norrköping, Sweden|Nyköpings lasarett hospital, Nyköping, Sweden|Karolinska University Hospital Huddinge, Stockholm, Sweden",,"https://ClinicalTrials.gov/show/NCT01785121"
663,"NCT02916849","A Feasibility Study of a Mobile Application Intervention to Promote Strength and Balance Exercises in Older People",,"Completed","No Results Available","Accidental Falls","Other: Safe Step|Other: OEP","Adherence|Change: Attitudes to Falls-Related Interventions Scale (AFRIS)|Change: Behavioural Regulation In Exercise Questionnaire (BREQ-2)|Change: Iconographical Falls Efficacy Scale (Icon-FES)|Change: Activity Specific Balance Confidence Scale (ABC)|Change: Late-Life Function and Disability Instrument (LLFDI)|Change: Short Physical Performance Battery|Change: 30 second chair-stand|Usability of the programs|Uptake","Umeå University|The Swedish Research Council|Forte|Glasgow Caledonian University","All","70 Years and older   (Older Adult)","Not Applicable","69","Other|Industry","Interventional","Allocation: Non-Randomized|Intervention Model: Parallel Assignment|Masking: Single (Outcomes Assessor)|Primary Purpose: Prevention","SafeStep","September 2016","March 31, 2017","March 31, 2017","September 28, 2016",,"December 15, 2017","Caring Science Buildning, Umeå University, Umeå, Sweden",,"https://ClinicalTrials.gov/show/NCT02916849"
