"Id","ParentTagId","Name","Slug","FullPath","Description","DatasetCount","CompetitionCount","KernelCount"
"1000","16313","general reference","general-reference","reference > general reference","","1029","0","12"
"1100","1000","reference works","reference-works","reference > general reference > reference works","","2","0","0"
"1103","1100","biography","biography","reference > general reference > reference works > biography","Who did what and when? This tag contains information on collections of notable figures, past and present.","36","0","0"
"1104","16316","dictionaries","dictionaries","reference > general reference > reference works > dictionaries and encyclopedias > dictionaries","A dictionary, sometimes known as a wordbook, is a collection of words in one or more specific languages, often arranged alphabetically (or by radical and stroke for ideographic languages), which may include information on definitions, usage, etymologies, phonetics, pronunciations, translation, etc.","11","0","3"
"1106","16316","encyclopedias","encyclopedias","reference > general reference > reference works > dictionaries and encyclopedias > encyclopedias","An encyclopedia is a reference work or compendium providing summaries of information from either all branches of knowledge or from a particular field or discipline.","1","0","0"
"1114","1100","trivia","trivia","reference > general reference > reference works > trivia","The trivia (singular trivium) are three lower Artes Liberales, i.e. grammar, logic, and rhetoric. These were the topics of basic education, foundational to the quadrivia of higher education, and hence the material of basic education and an important building block for all undergraduates.","1","0","0"
"1115","1100","web sites","web-sites","reference > general reference > reference works > web sites","Websites, like this one, are collections of content that can be found under a specific address. These datasets include information on individual websites or collections of websites.","50","0","22"
"1200","1000","research tools and topics","research-tools-and-topics","reference > general reference > research tools and topics","Research comprises ""creative and systematic work undertaken to increase the stock of knowledge, including knowledge of humans, culture and society, and the use of this stock of knowledge to devise new applications.""","73","0","5"
"1201","1200","academics","academics","reference > general reference > research tools and topics > academics","An academic discipline or academic field is a branch of knowledge. It incorporates expertise, people, projects, communities, challenges, studies, inquiry, and research areas that are strongly associated with a given scholastic subject area or college department.","6","0","4"
"1202","1200","archives","archives","reference > general reference > research tools and topics > archives","","3","0","8"
"1203","1200","books","books","reference > general reference > research tools and topics > books","A book is a series of pages assembled for easy portability and reading, as well as the composition contained in it.","61","0","12"
"1206","1200","databases","databases","reference > general reference > research tools and topics > databases","","102","0","93"
"1207","1200","online education","online-education","reference > general reference > research tools and topics > online education","","16","0","6"
"1208","1200","grammar","grammar","reference > general reference > research tools and topics > grammar","In linguistics, grammar is the set of structural rules governing the composition of clauses, phrases, and words in any given natural language.","3","0","3"
"1209","1200","government agencies","government-agencies","reference > general reference > research tools and topics > government agencies","Datasets and kernels under the government agencies tag tend to be related to public and open data initiatives from governments. They include police activity, labor statistics, and energy usage.","53","0","4"
"1211","1200","information","information","reference > general reference > research tools and topics > information","Information is the answer to a question of some kind. It is thus related to data and knowledge, as data represents values attributed to parameters, and knowledge signifies understanding of real things or abstract concepts.","18","0","10"
"1212","1200","knowledge","knowledge","reference > general reference > research tools and topics > knowledge","Knowledge is a familiarity, awareness, or understanding of someone or something, such as facts, information, descriptions, or skills, which is acquired through experience or education by perceiving, discovering, or learning.","7","0","21"
"1213","1200","libraries","libraries","reference > general reference > research tools and topics > libraries","Take a look in a book! These datasets include information on libraries, including what books get checked out and when.","22","0","22"
"1215","1200","news agencies","news-agencies","reference > general reference > research tools and topics > news agencies","News agencies are responsible for clickbait and sometimes reporting news accidentally. Ten things you need to know about news agencies: Click here.","51","1","18"
"1218","1200","reading","reading","reference > general reference > research tools and topics > reading","Reading is a complex cognitive process of decoding symbols in order to construct or derive meaning. You're doing it right now.","5","0","4"
"1219","1200","research","research","reference > general reference > research tools and topics > research","Research is our endeavor to systematically increase our knowledge about the world. Whether it's undertaken by greats like Einstein or underpaid graduate students, you'll find the fruits of their labor in this tag plus the kernels that make their work reproducible.","77","3","64"
"1220","1200","search engines","search-engines","reference > general reference > research tools and topics > search engines","","23","0","34"
"1222","1200","universities and colleges","universities-and-colleges","reference > general reference > research tools and topics > universities and colleges","This tag contains all kinds of information about which colleges are good and how much money people make after attending classes there.","1038","0","27"
"1223","1200","writing","writing","reference > general reference > research tools and topics > writing","One key skill you need as a data scientist is being able to clearly communicate results. On the other hand, as data scientists we can train AIs to write for us.","33","2","2"
"1224","1215","journalism","journalism","reference > general reference > research tools and topics > news agencies > journalism","The journalism tag contains datasets and analyses pertaining to various news agencies and reporters.","63","0","11"
"2000","","culture and arts","culture-and-arts","culture and arts","","0","0","0"
"2100","2000","culture and humanities","culture-and-humanities","culture and arts > culture and humanities","What is it to be human? What activities and patterns of behavior define us and our societies? This tag will help you tackle these questions.","32","0","5"
"2101","2100","classics","classics","culture and arts > culture and humanities > classics","","2","0","6"
"2102","2100","critical theory","critical-theory","culture and arts > culture and humanities > critical theory","Critical Theory is a school of thought that stresses the reflective assessment and critique of society and culture by applying knowledge from the social sciences and the humanities.","5","0","0"
"2104","2100","folklore","folklore","culture and arts > culture and humanities > folklore","","8","0","1"
"2106","2100","food and drink","food-and-drink","culture and arts > culture and humanities > food and drink","If you love food and drink, don't look in this tag unless you want to ruin your day by learning how many calories burritos have. On the other hand, do look into these datasets and kernels for general nutrition facts, restaurant ratings, and various food and drink related reviews.","508","6","371"
"2107","2100","languages","languages","culture and arts > culture and humanities > languages","Language is a method of communication that consists of using words arranged into meaningful patterns. This is a good place to find natural language processing datasets and kernels to study languages and train your chat bots.","210","3","60"
"2112","2100","popular culture","popular-culture","culture and arts > culture and humanities > popular culture","Popular culture datasets and kernels are associated with topics like TV shows, movies, music, and video games. The greatest screenwriters come here to train their AI to write movie scripts.","80","0","27"
"2113","2100","science and culture","science-and-culture","culture and arts > culture and humanities > science and culture","Culture is the social behavior and norms found in human societies. Science is a systematic enterprise that builds and organizes knowledge in the form of testable explanations and predictions about the universe.","10","0","2"
"2114","2100","traditions","traditions","culture and arts > culture and humanities > traditions","A tradition is a belief or behavior passed down within a group or society with symbolic meaning or special significance with origins in the past","1","0","0"
"2115","16105","alcohol","alcohol","culture and arts > culture and humanities > food and drink > beverages > alcohol","Here's to alcohol: the cause of, and solution to, all of life's problems. -- Homer J. Simpson","296","0","27"
"2200","2000","arts and entertainment","arts-and-entertainment","culture and arts > arts and entertainment","Activities that holds the attention and interest of an audience, or gives pleasure and delight. It can be an idea or a task, but is more likely to be one of the activities or events that have developed over thousands of years specifically for the purpose of keeping an audience's attention.","6022","0","16"
"2202","2200","celebrity","celebrity","culture and arts > arts and entertainment > celebrity","Celebrity is the fame and public attention we give to superstars of popular culture like the Kardashian family and Jeff Dean.","116","0","4"
"2203","2200","censorship","censorship","culture and arts > arts and entertainment > censorship","","1","0","0"
"2204","2200","festivals","festivals","culture and arts > arts and entertainment > festivals","","5","0","0"
"2205","2200","humor","humor","culture and arts > arts and entertainment > humor","Find kernels and datasets on jokes in this tag. Punchlines included.","245","0","7"
"2206","2200","literature","literature","culture and arts > arts and entertainment > literature","This tag is your digital library for varius copora such as Southern Literature, Paranormal Romance novels, and Urban Dictionary spelling variations.","540","1","9"
"2207","16090","museums","museums","culture and arts > arts and entertainment > libraries and museums > museums","Fun place to hang on a Saturday afternoon and think deep thoughts about deep things. Find datasets and kernels related to various museum collections here.","27","0","2"
"2208","2200","parties","parties","culture and arts > arts and entertainment > parties","A party is a gathering of people who have been invited by a host for the purposes of socializing, conversation, recreation, or as part of a festival or other commemoration of a special occasion.","3","0","1"
"2209","2206","poetry","poetry","culture and arts > arts and entertainment > literature > poetry","Poetry is a form of literature that uses aesthetic and rhythmic qualities of language--such as phonaesthetics, sound symbolism, and meter--to evoke meanings in addition to, or in place of, the prosaic ostensible meaning.","56","1","6"
"2300","2000","performing arts","performing-arts","culture and arts > performing arts","","43","0","0"
"2301","2300","circus","circus","culture and arts > performing arts > circus","","1","0","0"
"2302","2300","dance","dance","culture and arts > performing arts > dance","","89","0","0"
"2303","2300","film","film","culture and arts > performing arts > film","Grab a bucket of popcorn and come analyze these movie ratings. The world must know which blockbuster film is the blockbuster film of all time!","1732","2","21"
"2304","2300","music","music","culture and arts > performing arts > music","With all the music data out there, it's hard to believe someone hasn't trained robots to perform on stage yet. Or have they?","1136","0","57"
"2305","2300","opera","opera","culture and arts > performing arts > opera","","1","0","0"
"2306","2300","storytelling","storytelling","culture and arts > performing arts > storytelling","Storytelling describes the social and cultural activity of sharing stories, sometimes with improvisation, theatrics, or embellishment. We invite all data storytellers to explore these datasets.","10","0","125"
"2307","2300","theatre","theatre","culture and arts > performing arts > theatre","","29","0","0"
"2400","2000","visual arts","visual-arts","culture and arts > visual arts","Visual arts = eye candy. There are datasets and kernels about paintings, museums, and movie posters.","333","1","28"
"2402","16175","comics","comics","culture and arts > visual arts > comics and animation > comics","Zow! Thwap! Blammo! This tag is for comic books and graphic novels, past and present.","187","0","8"
"2403","8311","crafts","crafts","people and self > personal life > leisure > crafts","","35","0","0"
"2404","2400","design","design","culture and arts > visual arts > design","Design is the creation of a plan or convention for the construction of an object, system or measurable human interaction (as in architectural blueprints, engineering drawings, business processes, circuit diagrams, and sewing patterns).","45","0","1"
"2405","2400","drawing","drawing","culture and arts > visual arts > drawing","","15","0","2"
"2407","16175","animation","animation","culture and arts > visual arts > comics and animation > animation","","14","0","67"
"2409","2400","painting","painting","culture and arts > visual arts > painting","Painting is the practice of applying paint, pigment, color or other medium to a solid surface. The medium is commonly applied to the base with a brush, but other implements, such as knives, sponges, and airbrushes, can be used.","47","2","1"
"2410","2400","photography","photography","culture and arts > visual arts > photography","Photography is the science, art, application and practice of creating durable images by recording light or other electromagnetic radiation, either electronically by means of an image sensor, or chemically by means of a light-sensitive material such as photographic film.","510","0","10"
"2411","2400","sculpture","sculpture","culture and arts > visual arts > sculpture","","4","0","0"
"2500","2000","games and toys","games-and-toys","culture and arts > games and toys","One of the hallmarks of intelligence is the use of games and toys to occupy free time and develop intellectually. Often stored in Mom's basement.","976","0","22"
"2501","2500","board games","board-games","culture and arts > games and toys > board games","A board game is a tabletop game that involves counters or pieces moved or placed on a pre-marked surface or ""board"", according to a set of rules.","53","1","9"
"2502","2500","card games","card-games","culture and arts > games and toys > card games","A card game is any game using playing cards as the primary device with which the game is played, be they traditional or game-specific. Countless card games exist, including families of related games (such as poker).","28","1","9"
"2504","2500","puppetry","puppetry","culture and arts > games and toys > puppetry","""""","0","0","0"
"2505","2500","puzzles","puzzles","culture and arts > games and toys > puzzles","A puzzle is a game, problem, or toy that tests a person's ingenuity or knowledge. In a puzzle, the solver is expected to put pieces together in a logical way, in order to arrive at the correct solution of the puzzle.","130","0","11"
"2506","2500","role-playing games","role-playing-games","culture and arts > games and toys > role-playing games","","212","0","3"
"2507","2500","video games","video-games","culture and arts > games and toys > video games","Video games were originally created to prevent people from going to college and getting good jobs. That back-fired and now we have data centers full of GPUs training models to tell the difference between cats and dogs. All thanks to gamers.","867","3","260"
"2601","4141","air sports","air-sports","health and fitness > self care > exercise > sports > air sports","","1","0","0"
"2602","16203","american football","american-football","health and fitness > self care > exercise > sports > team sports > american football","Blue! 42! Hut hut! Pour gatorade all over your GPU and go for the hail mary! Analyze these datasets and predict who is going to win the Superbowl.","283","2","30"
"2603","16203","association football","association-football","health and fitness > self care > exercise > sports > team sports > association football","Some call it association football, some call it soccer, most call it sport ball. Come analyze the teams and players of the beautiful game.","474","0","61"
"2604","4141","auto racing","auto-racing","health and fitness > self care > exercise > sports > auto racing","","41","0","24"
"2605","16203","baseball","baseball","health and fitness > self care > exercise > sports > team sports > baseball","Baseball is a bat-and-ball game played between two teams of nine players each who take turns batting and fielding.","112","0","20"
"2606","16203","basketball","basketball","health and fitness > self care > exercise > sports > team sports > basketball","Basketball is one of the world's most popular and widely viewed sports. Analyze Kobe Bryant's shot selections and peruse our annual March Mania competitions.","313","11","96"
"2607","4141","boating","boating","health and fitness > self care > exercise > sports > boating","","29","0","0"
"2608","16188","boxing","boxing","health and fitness > self care > exercise > sports > combat sports > boxing","","3","0","0"
"2609","4141","canoeing","canoeing","health and fitness > self care > exercise > sports > canoeing","","0","0","0"
"2610","16203","cricket","cricket","health and fitness > self care > exercise > sports > team sports > cricket","Cricket is a sport, but I don't see any reason why there shouldn't be a dataset about crickets here, too.","203","0","34"
"2613","16273","fishing","fishing","people and self > personal life > leisure > outdoors > fishing","Fishing is primarily an excuse to relax outdoors and lie about ""the big one"" to your friends. Sometimes there are even fish involved.","13","1","2"
"2614","16194","golf","golf","health and fitness > self care > exercise > sports > individual sports > golf","Golf is a club and ball sport in which players use various clubs to hit balls into a series of holes on a course in as few strokes as possible.","39","0","0"
"2615","16194","gymnastics","gymnastics","health and fitness > self care > exercise > sports > individual sports > gymnastics","Gymnastics is a sport practiced by men and women that requires balance, strength, flexibility, agility, coordination, endurance and control.","3","0","0"
"2616","4141","hobbies","hobbies","health and fitness > self care > exercise > sports > hobbies","","2","0","1"
"2617","4141","horse racing","horse-racing","health and fitness > self care > exercise > sports > horse racing","I bet I can make my horse racing model overfit the data faster than your horse racing model.","13","0","2"
"2618","16203","ice hockey","ice-hockey","health and fitness > self care > exercise > sports > team sports > ice hockey","Ice hockey is a contact team sport played on ice, usually in a rink, in which two teams of skaters use their sticks to shoot a vulcanized rubber puck into their opponent's net to score points.","48","0","6"
"2619","4141","lacrosse","lacrosse","health and fitness > self care > exercise > sports > lacrosse","","0","0","0"
"2620","16198","olympic games","olympic-games","health and fitness > self care > exercise > sports > international sports competitions > olympic games","Every two years, athletes from around the world gather to see who's the best of the best. Participate in the fun with these Olympic Games datasets and kernels.","49","0","20"
"2621","16203","rugby league","rugby-league","health and fitness > self care > exercise > sports > team sports > rugby league","Rugby league football is a full-contact sport played by two teams of thirteen players on a rectangular field.","8","0","1"
"2623","4141","sailing","sailing","health and fitness > self care > exercise > sports > sailing","Sailing employs the wind to propel a craft on the surface of the water over a chosen course, which is often part of a larger plan of navigation.","1","0","0"
"2624","16209","skiing","skiing","health and fitness > self care > exercise > sports > winter sports > skiing","","11","0","0"
"2626","4141","tennis","tennis","health and fitness > self care > exercise > sports > tennis","Tennis is a racket sport that enjoys worldwide popularity among athletes, recreational players, and sports analytics junkies.","22","0","8"
"2627","16194","track and field","track-and-field","health and fitness > self care > exercise > sports > individual sports > track and field","","3","0","0"
"2629","4141","water sports","water-sports","health and fitness > self care > exercise > sports > water sports","","8","0","0"
"2630","4141","whitewater sports","whitewater-sports","health and fitness > self care > exercise > sports > whitewater sports","","0","0","0"
"3000","","geography and places","geography-and-places","geography and places","","0","0","0"
"3001","3000","earth","earth","geography and places > earth","","2","0","2"
"3002","3000","world","world","geography and places > world","The kernels and datasets with this tag make the world go 'round.","422","0","81"
"3003","3000","bodies of water","bodies-of-water","geography and places > bodies of water","Lakes, oceans, rivers, streams, and infamous puddles.","17","0","3"
"3004","3000","cities","cities","geography and places > cities","In this tag you will find datasets and kernels about various cities around the world.","107","1","31"
"3005","3000","communities","communities","geography and places > communities","A community is a small or large social unit (a group of living things) who have something in common, such as norms, religion, values, or identity.","12","0","8"
"3007","3000","countries","countries","geography and places > countries","A country is a region that is identified as a distinct national entity in political geography.","130","0","52"
"3008","3000","deserts","deserts","geography and places > deserts","","0","0","0"
"3009","3000","lakes","lakes","geography and places > lakes","","4","0","1"
"3011","3000","mountains","mountains","geography and places > mountains","From the Appalachians to Zwiselbacher Rosskogel, this tag has all the info you need about mountains.","7","0","0"
"3012","3000","navigation","navigation","geography and places > navigation","Navigation is a field of study that focuses on the process of monitoring and controlling the movement of a craft or vehicle from one place to another.","6","0","0"
"3013","3000","oceans","oceans","geography and places > oceans","Does anyone happen to know where you can go to find the best place for kite-foil racing without being eaten by a shark? Anyone?","17","0","2"
"3014","3000","populated places","populated-places","geography and places > populated places","In geography, statistics and archaeology, a settlement, locality or populated place is a community in which people live. A settlement can range in size from a small number of dwellings grouped together to the largest of cities with surrounding urbanized areas.","17","0","1"
"3015","3000","protected areas","protected-areas","geography and places > protected areas","","0","0","0"
"3017","3000","rivers","rivers","geography and places > rivers","","13","0","1"
"3022","3200","united states","united-states","geography and places > north america > united states","The top datasets and kernels in this tag are about mass shootings, AirBnB, homelessness, and witchcraft. That about sums it up.","175","0","75"
"3023","3600","india","india","geography and places > asia > india","This tag will take you to the wonderful land of datasets and kernels related to India. You will find topics that range far and wide. There's education, travel, weather, and crime, too.","255","0","208"
"3024","3600","china","china","geography and places > asia > china","China, officially the People's Republic of China, is a unitary sovereign state in East Asia and the world's most populous country, with a population of around 1.404 billion.","32","0","35"
"3025","3300","brazil","brazil","geography and places > south america > brazil","You don't have to visit Brazil to learn about their politics, soccer, and brush with Zika. This tag covers all the things you might be interested in about Brazil.","156","0","68"
"3100","3000","europe","europe","geography and places > europe","You can find some European linguistic type datasets here as well as other European-like datasets and kernels.","232","0","14"
"3200","3000","north america","north-america","geography and places > north america","North America includes Canada, Mexico and the United States. If you're looking for data about any or all of these places, this is the tag you need.","15","0","2"
