,title,score,view_count
0,Why are the images generated by a GAN get darker as the network trains more?,9,439
1,Understanding Generative Adversarial Networks,5,65
2,"Adding constraints to Generative Adversarial Networks, e.g. no dogs with two heads",4,539
3,Discriminator gradients are all zeros while training a Conditional GAN in TensorFlow,2,28
4,Calculating output after convolution and transpose convolution,2,32
5,Having a GAN interact with a mail server?,2,37
6,Wasserstein GAN problem with last discriminator layer and clipping,2,36
7,"Deep Learning, Strange batch normalization",2,64
8,Keras optimizer is not supported when eager execution is enabled,1,34
9,How can I train Super-Resolution Generative Adversarial Network (SRGAN) with high-frequency grayscale images?,1,31
10,How to balance the generator and the discriminator performances in a GAN?,1,33
11,stylegan encoder print image is too small,1,6
12,Neural Network Architecture for Binary Sequential Data,1,13
13,Practical Uncertainties in &quot;Reverse&quot; NLLLoss for Generative Adversarial Network,1,24
14,Classifying 64x4 images representing piano rolls as real or fake,1,28
15,How to reset Tensorflow Graph in Flask?,1,76
16,How to implement cross validation for a Generative Adversarial Network (GAN) in keras?,1,46
17,Stylegan2 Tensorflow training interrupts after a a minute in Google Colab,1,91
18,Keras: Manually backprop from Discriminator to Generator,1,57
19,How to correct Python-Tensorflow has no attribute error &#39;&#39;getdlopenflags&#39;?,1,45
20,GAN conditioning input in NiftyNet,1,28
21,GAN generator producing distinguishable output,1,32
22,"100-line Tensorflow code and Keras equivalent do not produce the same result, Tensorflow result does not converge, why?",1,33
23,how can I apply median filter for this generator?,1,43
24,How to refer to one output of multioutput model,1,15
25,RuntimeError: Error(s) in loading state_dict for Generator: size mismatch for weights and biases using Pytorch,1,443
26,How to implement GAN to generate fake data for 1Dimensional Data (CWRU dataset) in tensorflow or keras?,1,41
27,Trying to run SummitKwan&#39;s transparent_latent_gen to generate faces in Google Colab,1,33
28,How to force a generator in a GAN to explore?,1,23
29,How to use trained generator to generate different samples,1,44
