Task-specific upper-extremity robotic training for stroke neurorehabilitation,VA,9857486,5I01RX001966-05,5,I01,VA,1966,5,,,8774023,"LUM, PETER S.",Not Applicable,U.S. DEPT/VETS AFFAIRS MEDICAL CENTER,,2020,,
Access to parietal action representations after stroke lesions in visual cortex,NEI,9868307,5R01EY028535-02,5,R01,EY,28535,2,,,10207201,"MAHON, BRADFORD ZACK ","SAHIN, BOGACHAN ",CARNEGIE-MELLON UNIVERSITY,,2020,423007,
Genome-wide structural organization of proteins within human gene regulatory complexes,NIGMS,9840489,5R01GM125722-03,5,R01,GM,125722,3,,,8616002,"MAHONY, SHAUN AENGUS ","PUGH, B FRANKLIN",PENNSYLVANIA STATE UNIVERSITY-UNIV PARK,,2020,319962,
Development of Ryan Companion Robot for Assisting Elderly People with Alzheimer's Disease,NIA,9950170,4R44AG059483-02,4,R44,AG,59483,2,,,11355283,"MAHOOR, MOHAMMAD ",Not Applicable,"DREAM FACE TECHNOLOGIES, LLC",,2019,667627,
Development of Serious Games and Physical Activities Instructed by a Social Robot for Improving the Well-being of Elderly Individuals with Alzheimer's Disease and Dementia,NIA,10020305,5R44AG066439-02,5,R44,AG,66439,2,,,11355283,"MAHOOR, MOHAMMAD ",Not Applicable,"DREAM FACE TECHNOLOGIES, LLC",,2020,536476,
Structural Biology,NCI,9934920,2P30CA030199-39,2,P30,CA,30199,39,,5579,3152673,"MARASSI, FRANCESCA M",Not Applicable,SANFORD BURNHAM PREBYS MEDICAL DISCOVERY INSTITUTE,,2020,,255364
Biomedical Technology Program,NCI,9993310,5P30CA093373-18,5,P30,CA,93373,18,,8705,6647839,"MARCU, LAURA ",Not Applicable,UNIVERSITY OF CALIFORNIA AT DAVIS,,2020,,33310
Fluorescence lifetime imaging/spectroscopy system for robotic cancer surgery guid,NCI,9781373,5R01CA187427-06,5,R01,CA,187427,6,,,6647839,"MARCU, LAURA  ","FARWELL, DONALD GREGORY;SORGER, JONATHAN M",UNIVERSITY OF CALIFORNIA AT DAVIS,,2019,188788,
WHM CONSULTING LLC:1197753 [18-006751],NIDA,9915358,271201400017I-P00002-27100005-1,,N02,DA,,,,,15974960,"MARTIN, WILLIAM ",Not Applicable,WHM CONSULTING,,2019,23000,
Simulating Tendon Reconstructive Surgeries using a Virtual Hand Model and Robotic Testbed,NIAMS,9968082,5R21AR076269-02,5,R21,AR,76269,2,,,8473240,"MASCARO, STEPHEN ",Not Applicable,UNIVERSITY OF UTAH,,2020,134200,
A novel robotic wastewater analysis system to quantify opioid exposure and treatment in residential communities,NIDA,9991436,1R44DA051106-01,1,R44,DA,51106,1,,,14484808,"MATUS GARCIA, MARIANA G ","CHAI, PETER R","BIOBOT ANALYTICS, INC.",,2020,212327,
Optimizing impedance control of an ankle exoskeleton to improve post-stroke walking mechanics and energetics,NICHD,9918154,5F31HD097872-02,5,F31,HD,97872,2,,,14940939,"MCCAIN, EMILY ",Not Applicable,NORTH CAROLINA STATE UNIVERSITY RALEIGH,,2020,41422,
Barcoding a Salmonella gene knockout library,NIAID,9746113,1R03AI139557-01A1,1,R03,AI,139557,1,A1,,1878830,"MCCLELLAND, MICHAEL ",Not Applicable,UNIVERSITY OF CALIFORNIA-IRVINE,,2019,78041,
The Microscopic Imaging of Epigenetic Landscape- NeuroDevelopment (MIEL-ND) assay: a high throughput platform to screen compounds for neurodevelopmental effects,NIMH,9623072,1R41MH119621-01A1,1,R41,MH,119621,1,A1,,1882226,"MCDONOUGH, PATRICK M",Not Applicable,"VALA SCIENCES, INC.",,2018,300000,
Rebuilding a Micro-Organ: Using Synthetic Morphological Tools to Probe and Engineer the Structure and Function of Pancreatic Islets,NIDDK,9992282,1F32DK123939-01A1,1,F32,DK,123939,1,A1,,12640096,"MCKEITHAN, WESLEY LAWRENCE",Not Applicable,"UNIVERSITY OF CALIFORNIA, SAN FRANCISCO",,2020,65310,
Research Services Core (RSC),NCATS,10011454,1ZICTR000242-05,1,ZIC,TR,242,5,,,15198057,"MICHAEL, SAMUEL ",Not Applicable,,,2019,8364044,
HEAL: New Chemical Structures for Pain; Addiction and Overdose Targets,NCATS,9994052,1ZIATR000344-02,1,ZIA,TR,344,2,,,15198057,"MICHAEL, SAMUEL ",Not Applicable,,,2019,5893563,
A primate model of an intra-cortically controlled FES prosthesis for grasp,NINDS,9761600,5R01NS053603-13,5,R01,NS,53603,13,,,2080564,"MILLER, LEE E ","MUSSA-IVALDI, FERDINANDO ALESSANDRO;PERREAULT, ERIC JON;SOLLA, SARA A",NORTHWESTERN UNIVERSITY AT CHICAGO,,2019,624666,
Quantitative High Throughput Screening for Small Molecules Targeting CD47 in Cancer,NCI,9786065,7U01CA218259-02,7,U01,CA,218259,2,,,11119905,"MILLER, THOMAS W",Not Applicable,INSTITUT JEAN PAOLI & IRENE CALMETTES CENTRE REGIONAL DE LUTTE CONTRE LE CANCER,,2020,242998,
Advancing predictive physical modeling through focused development of model systems to drive new modeling innovations,NIGMS,9932112,3R01GM124270-02S1,3,R01,GM,124270,2,S1,,10175415,"MOBLEY, DAVID LOWELL",Not Applicable,UNIVERSITY OF CALIFORNIA-IRVINE,,2019,66531,
Advancing predictive physical modeling through focused development of model systems to drive new modeling innovations,NIGMS,9778863,5R01GM124270-02,5,R01,GM,124270,2,,,10175415,"MOBLEY, DAVID LOWELL",Not Applicable,UNIVERSITY OF CALIFORNIA-IRVINE,,2019,278369,
Shared Resource 06: DNA Resource,NCI,10063023,3P30CA006516-55S4,3,P30,CA,6516,55,S4,5383,1895675,"MOHR, STEPHANIE E",Not Applicable,DANA-FARBER CANCER INST,,2020,,2949
Shared Resource 06: DNA Resource,NCI,9842676,5P30CA006516-55,5,P30,CA,6516,55,,5383,1895675,"MOHR, STEPHANIE E",Not Applicable,DANA-FARBER CANCER INST,,2020,,241246
Shared Resource: Microscopy; Imaging and Cytometry Resources,NCI,9836630,5P30CA022453-38,5,P30,CA,22453,38,,7555,1979493,"MOIN, KAMIAR ",Not Applicable,WAYNE STATE UNIVERSITY,,2020,,323931
Dynamic Haptic Robotic Training for Central Venous Catheter Insertion,NHLBI,9816965,2R01HL127316-04A1,2,R01,HL,127316,4,A1,,11395079,"MOORE, JASON ZACHARY ","MILLER, SCARLETT ",PENNSYLVANIA STATE UNIV HERSHEY MED CTR,,2019,569636,
Validating Neuroelectric Biomarkers of Concussion Recovery,NINDS,9706067,5R03NS106547-02,5,R03,NS,106547,2,,,15038320,"MOORE, ROBERT DAVIS",Not Applicable,UNIVERSITY OF SOUTH CAROLINA AT COLUMBIA,,2019,73250,
U2C Experimental Core,NIEHS,9981749,5U2CES030163-03,5,U2C,ES,30163,3,,6969,1887669,"MORGAN, EDWARD THOMAS",Not Applicable,EMORY UNIVERSITY,,2020,,675273
Fiber-Optic Sensor System for Sleep Disorder Monitoring,NHLBI,9774962,1R43HL147650-01,1,R43,HL,147650,1,,,9165091,"MOSLEHI, BEHZAD ",Not Applicable,INTELLIGENT FIBER OPTIC SYSTEMS CORP,,2019,134132,
Novel Ultrasound Localization of Pulmonary Nodules during Video Assisted Thoracic Surgery to Improve Surgical Resection,NCI,9870900,5R21CA231503-02,5,R21,CA,231503,2,,,12579511,"MULLER, MARIE  ","EGAN, THOMAS M.",NORTH CAROLINA STATE UNIVERSITY RALEIGH,,2020,159685,
Increased sensitivity of minimal residual disease monitoring using peripheral blood in pediatric patients with acute lymphoblastic leukemia,NCI,10012271,4R44CA224848-02,4,R44,CA,224848,2,,,14483466,"MULLER, ROLF ",Not Applicable,"BIOFLUIDICA, INC",,2019,837994,
Parallel and high throughput isolation of cancer cell derived extracellular vesicles,NCI,9620946,1R43CA232848-01,1,R43,CA,232848,1,,,14483466,"MULLER, ROLF ",Not Applicable,"BIOFLUIDICA, INC",,2018,239138,
Parallelized Cell Isolation in a Well Plate Format using Ratcheting Cytometry,NHLBI,9846105,1R43HL149552-01,1,R43,HL,149552,1,,,14372441,"MURRAY, COLEMAN ",Not Applicable,"FERROLOGIX, INC.",,2019,225000,
Understanding and Using Variation in Source Materials for MSC Fabrication,NIDCR,9995457,5R01DE029634-02,5,R01,DE,29634,2,,,8218953,"MUSCHLER, GEORGE F",Not Applicable,CLEVELAND CLINIC LERNER COM-CWRU,,2020,622650,
Receptor-mediated clearance of synaptic tau as a novel therapy for Alzheimer's disease.,NIA,9913433,5K01AG055694-04,5,K01,AG,55694,4,,,9383432,"MYEKU, NATURA ",Not Applicable,COLUMBIA UNIVERSITY HEALTH SCIENCES,,2020,124551,
Exo-Seq for the single molecule of DNA molecules,NHGRI,9733796,1R43HG010551-01,1,R43,HG,10551,1,,,15252800,"NAGEL, AARON C",Not Applicable,"DIGITAL NANOGENETICS, LLC",,2019,342831,
Socially-Assistive Robots for Alzheimer?s (SARA),NIA,9909512,1R43AG066288-01,1,R43,AG,66288,1,,,12408709,"NIEHAUS, JAMES M",Not Applicable,"CHARLES RIVER ANALYTICS, INC.",,2019,535315,
Rodent Cancer Models Core,NCI,9853600,2P30CA014236-46,2,P30,CA,14236,46,,7815,1920922,"NORTON, JOHN N.",Not Applicable,DUKE UNIVERSITY,,2020,,491989
Integrated multichannel system for transcranial magnetic stimulation and parallel magnetic resonance imaging,NIMH,9728040,5R01MH111829-04,5,R01,MH,111829,4,,,11119767,"NUMMENMAA, AAPO ",Not Applicable,MASSACHUSETTS GENERAL HOSPITAL,,2019,817945,
Method Development: Efficient Computer Vision Based Algorithms,NCI,10014371,1ZIABC010442-18,1,ZIA,CA,10442,18,,,8300611,"NUSSINOV, RUTH ",Not Applicable,,,2019,171764,
CIP Microbiome and Genetics Core,NCI,10015060,1ZICBC011237-11,1,ZIC,CA,11237,11,,,10274554,"OHUIGIN, COLM ",Not Applicable,,,2019,1964469,
High-Throughput Droplet-Scale Functional Screening of DNA-Encoded Combinatorial Libraries,NIGMS,9850274,5R01GM120491-05,5,R01,GM,120491,5,,,6944867,"PAEGEL, BRIAN M",Not Applicable,UNIVERSITY OF CALIFORNIA-IRVINE,,2020,301422,
High Throughput Screening of Pharmaceuticals Targeting Heart Cell Contractile Function,NHLBI,9776252,2R44HL137603-02A1,2,R44,HL,137603,2,A1,,1899370,"PALMER, BRADLEY M",Not Applicable,"IONOPTIX, LLC",,2019,754124,
Smart template for prostate biopsy guidance,NCI,9981861,4R44CA224853-02,4,R44,CA,224853,2,,,10141636,"PARK, JESUNG ",Not Applicable,"PHYSICAL SCIENCES, INC",,2019,597435,
Error-enhanced Learning & Recovery in 2 & 3 Dimensions,NINDS,10053077,2R01NS053606-10A1,2,R01,NS,53606,10,A1,,8289805,"PATTON, JAMES LANPHIER",Not Applicable,REHABILITATION INSTITUTE OF CHICAGO D/B/A SHIRLEY RYAN ABILITYLAB,,2020,543401,
Circuit dynamics of sensorimotor integration and decision making in octopus,NINDS,9949982,1UF1NS115817-01,1,UF1,NS,115817,1,,,8895970,"PELLED, GALIT ",Not Applicable,MICHIGAN STATE UNIVERSITY,,2020,2323583,
Flow Cytometry Core,NIAID,10018442,1ZICAI005101-11,1,ZIC,AI,5101,11,,,16169734,"PERFETTO, STEPHEN ",Not Applicable,,,2019,2613776,
Transcranial magnetic stimulation with enhanced focality and depth (fdTMS),NIMH,9390626,1RF1MH114268-01,1,RF1,MH,114268,1,,,8573196,"PETERCHEV, ANGEL V",Not Applicable,DUKE UNIVERSITY,,2017,1564107,
High Throughput of Protein-based Voltage Probes,NINDS,9769176,5U01NS103517-03,5,U01,NS,103517,3,,,1862562,"PIERIBONE, VINCENT A",Not Applicable,"JOHN B. PIERCE LABORATORY, INC.",,2019,789427,
Patient-Centered Pain Care Using Artificial Intelligence and Mobile Health Tools,VA,10181034,5I01HX001460-05,5,I01,VA,1460,5,,,6400536,"PIETTE, JOHN D. ","HEAPY, ALICIA ",VETERANS HEALTH ADMINISTRATION,,2020,,
Patient-Centered Pain Care Using Artificial Intelligence and Mobile Health Tools,VA,10179467,5I01HX001460-04,5,I01,VA,1460,4,,,6400536,"PIETTE, JOHN D. ","HEAPY, ALICIA ",VETERANS HEALTH ADMINISTRATION,,2020,,
Patient-Centered Pain Care Using Artificial Intelligence and Mobile Health Tools,VA,10176571,5I01HX001460-03,5,I01,VA,1460,3,,,6400536,"PIETTE, JOHN D. ","HEAPY, ALICIA ",VETERANS HEALTH ADMINISTRATION,,2020,,
Patient-Centered Pain Care Using Artificial Intelligence and Mobile Health Tools,VA,9145506,5I01HX001460-02,5,I01,VA,1460,2,,,6400536,"PIETTE, JOHN D. ","HEAPY, ALICIA ",VETERANS HEALTH ADMINISTRATION,,2020,,
Signal Processing And Instrumentation Section,CIT,10018389,1ZIACT000261-23,1,ZIA,CT,261,23,,,6569827,"POHIDA, THOMAS J",Not Applicable,,,2019,1930370,
Structure and Function of DNA Polymerase Theta,NIGMS,9869929,5R01GM130889-02,5,R01,GM,130889,2,,,9640800,"POMERANTZ, RICHARD T",Not Applicable,TEMPLE UNIV OF THE COMMONWEALTH,,2020,392517,
Development of the Osseointegrated Neural Interface for prosthetic control into a pre-clinical translational sheep model.,VA,9836222,1I01RX003129-01A1,1,I01,VA,3129,1,A1,,12143060,"POORE, SAMUEL ",Not Applicable,WM S. MIDDLETON MEMORIAL VETERANS HOSP,,2020,,
Robotics may help unravel the biological determinants of substance use disorders: studies in zebrafish,NIDA,9536748,5R21DA042558-02,5,R21,DA,42558,2,,,11145110,"PORFIRI, MAURIZIO ",Not Applicable,NEW YORK UNIVERSITY,,2018,173125,
Developing a Therapeutics Platform for Adenoid Cystic Carcinoma,NIDCR,9933329,1R21DE029444-01,1,R21,DE,29444,1,,,1884199,"POSNER, MARSHALL R",Not Applicable,ICAHN SCHOOL OF MEDICINE AT MOUNT SINAI,,2020,254250,
Locomotor learning in infants at high risk for cerebral palsy,NICHD,9887789,1R01HD098364-01A1,1,R01,HD,98364,1,A1,,11287018,"PROSSER, LAURA ANNE ","KOLOBE, HLAPANG A.;SMITH, BETH A",CHILDREN'S HOSP OF PHILADELPHIA,,2020,807249,
Plasma proteomics in CHS and population biology,NHLBI,9976578,5R01HL144483-02,5,R01,HL,144483,2,,,1878095,"PSATY, BRUCE M ","GERSZTEN, ROBERT E;TRACY, RUSSELL P",UNIVERSITY OF WASHINGTON,,2020,2083439,
Rapid?Response Macromolecular Crystallography,NIGMS,9749179,5P30GM124169-03,5,P30,GM,124169,3,,6884,2240376,"RALSTON, CORIE Y",Not Applicable,UNIVERSITY OF CALIF-LAWRENC BERKELEY LAB,,2019,,357385
SeeTrue: The Microinjection Colored Needle For Enhanced Visibility and Anti-Clogging Capabilities,NIGMS,9680203,1R43GM131486-01,1,R43,GM,131486,1,,,15458493,"RAND, KINNERET ",Not Applicable,"SEETRUE TECHNOLOGY, LLC",,2019,148517,
EFFECTIVENESS OF ROBOT-ASSISTED HAND MOVEMENT TRAINING AFTER STROKE,NICHD,9925839,5R01HD062744-08,5,R01,HD,62744,8,,,9776158,"REINKENSMEYER, DAVID JAY",Not Applicable,UNIVERSITY OF CALIFORNIA-IRVINE,,2020,305956,
High-throughput disease modeling to uncover shared and unique characteristics among neurodegenerative diseases,NINDS,9906992,1F31NS111851-01A1,1,F31,NS,111851,1,A1,,14412823,"RESNICK, SAMUEL JACKSON",Not Applicable,COLUMBIA UNIVERSITY HEALTH SCIENCES,,2019,45016,
Multi-Frequency Tracker for Control of Handheld Surgical Robotic Systems,NIBIB,9839551,5R01EB024564-03,5,R01,EB,24564,3,,,6183690,"RIVIERE, CAMERON N",Not Applicable,CARNEGIE-MELLON UNIVERSITY,,2020,341527,
Probe for Quantitative Fluorescence. Phase 2,NINDS,10011739,2R44NS108845-02,2,R44,NS,108845,2,,,8134951,"ROBERTS, DAVID W",Not Applicable,"INSIGHT SURGICAL TECHNOLOGIES, LLC",,2020,1088424,
X-Ray Crystallography and Macromolecular Characterization,NCI,9956994,5P30CA056036-21,5,P30,CA,56036,21,,5308,1864338,"ROOT, MICHAEL JEFFREY",Not Applicable,THOMAS JEFFERSON UNIVERSITY,,2020,,104288
Altering Activation Patterns in the Distal Upper Extremity After Stroke,NICHD,9654015,5R01HD075813-05,5,R01,HD,75813,5,,,8564476,"ROTH, ELLIOT J.",Not Applicable,REHABILITATION INSTITUTE OF CHICAGO D/B/A SHIRLEY RYAN ABILITYLAB,,2019,366006,
TR&D Project 1. The Sample Stage: Tools for Isolating and Preserving Macromolecular Hierarchies,NIGMS,9922919,5P41GM109824-07,5,P41,GM,109824,7,,8346,6488610,"ROUT, MICHAEL P",Not Applicable,ROCKEFELLER UNIVERSITY,,2020,,238457
Next-generation Mass Spectrometry Technologies for Integrated Structural Proteomics,NIGMS,9626422,5R01GM095832-08,5,R01,GM,95832,8,,,9844381,"RUOTOLO, BRANDON T ","ANDREWS, PHILIP C",UNIVERSITY OF MICHIGAN AT ANN ARBOR,,2019,531190,
Core 1: Pathology core,NCI,9792322,2P50CA092131-16A1,2,P50,CA,92131,16,A1,8741,6287823,"SAID, JONATHAN W.",Not Applicable,UNIVERSITY OF CALIFORNIA LOS ANGELES,,2019,,182739
Genomics Core,NIGMS,9741726,5P30GM118430-04,5,P30,GM,118430,4,,8374,7031078,"SALBAUM, J MICHAEL",Not Applicable,LSU PENNINGTON BIOMEDICAL RESEARCH CTR,,2019,,182107
Molecular Screening and Protein Expression Shared Resource,NCI,9917711,5P30CA010815-51,5,P30,CA,10815,51,,7328,9880106,"SALVINO, JOSEPH M",Not Applicable,WISTAR INSTITUTE,,2020,,192601
Basic-Genomics High-Throughput Facility (GHTF),NCI,9851358,5P30CA062203-23,5,P30,CA,62203,23,,4038,1887814,"SANDMEYER, SUZANNE ",Not Applicable,UNIVERSITY OF CALIFORNIA-IRVINE,,2020,,110233
Center for Limb Loss Prevention and Prosthetic Engineering,VA,9787162,5I50RX002357-03,5,I50,VA,2357,3,,,8651438,"SANGEORZAN, BRUCE ",Not Applicable,VA PUGET SOUND HEALTHCARE SYSTEM,,2020,,
Impact of a Novel Socially Assistive Robotic Architecture on Engaging Older Adults with Mild Cognitive Impairment; Alzheimer's Disease; and Related Dementia in Long Term   Care Settings,NIA,9972542,1R01AG062685-01A1,1,R01,AG,62685,1,A1,,8144912,"SARKAR, NILANJAN  ","MION, LORRAINE C",VANDERBILT UNIVERSITY,,2020,633753,
NIH R21/R33: Transformative Co-Robotic Technology for Autism Intervention,NIMH,9460558,5R33MH103518-05,5,R33,MH,103518,5,,,8144912,"SARKAR, NILANJAN ",Not Applicable,VANDERBILT UNIVERSITY,,2018,258752,
HTS Drug Discovery Dispensers,OD,9708364,1S10OD026857-01,1,S10,OD,26857,1,,,8744831,"SCAMPAVIA, LOUIS DANIEL",Not Applicable,SCRIPPS FLORIDA,,2019,452106,
Advanced Sample Preparation Approaches for High Sensitivity and Specificity IMS (pp  371-412),NIGMS,9842536,5P41GM103391-10,5,P41,GM,103391,10,,8141,1901713,"SCHEY, KEVIN L",Not Applicable,VANDERBILT UNIVERSITY,,2020,,258439
Core B: High-Throughput Biology,NIA,9950962,5P01AG031862-13,5,P01,AG,31862,13,,8865,2241267,"SCHULTZ, DAVID C",Not Applicable,UNIVERSITY OF PENNSYLVANIA,,2020,,209043
Multiplex food allergy diagnostic based on IgE immunologic markers,NIAID,10011621,2R44AI141118-02,2,R44,AI,141118,2,,,14266924,"SEFTEL, DAVID ",Not Applicable,"ENABLE BIOSCIENCES, INC.",,2020,845777,
An Ultrasensitive; High-Throughput; and Low-Cost Autoimmunity Panel for the Early Diagnosis and Improved Treatment of Type 1 Diabetes,NIDDK,9688998,5R44DK111005-03,5,R44,DK,111005,3,,,14266924,"SEFTEL, DAVID ",Not Applicable,"ENABLE BIOSCIENCES, INC.",,2019,749838,
Development of An Automated High-Throughput Dried Blood Spot Assay to Facilitate Large Scale Screening for Type 1 Diabetes Risk,NIDDK,9910015,1R44DK124009-01,1,R44,DK,124009,1,,,14266924,"SEFTEL, DAVID ",Not Applicable,"ENABLE BIOSCIENCES, INC.",,2019,746584,
Biomaterials to promote synapse formation after stroke,NINDS,9961194,1R01NS112940-01A1,1,R01,NS,112940,1,A1,,8786069,"SEGURA, TATIANA ",Not Applicable,DUKE UNIVERSITY,,2020,539814,
StretchfMRI: a new technique to study the brainstem correlates of long-latency responses,NINDS,9896490,1R21NS111310-01A1,1,R21,NS,111310,1,A1,,12457987,"SERGI, FABRIZIO ",Not Applicable,UNIVERSITY OF DELAWARE,,2020,254761,
Predictive biophysical models of evolution,NIGMS,9822975,5R01GM068670-16,5,R01,GM,68670,16,,,1881552,"SHAKHNOVICH, EUGENE I",Not Applicable,HARVARD UNIVERSITY,,2020,569400,
Clinical Translation of Augmented Reality Visualization for Laparoscopic Surgery,NCI,9451251,5R42CA192504-03,5,R42,CA,192504,3,,,7681341,"SHEKHAR, RAJ ",Not Applicable,"IGI TECHNOLOGIES, INC.",,2018,718421,
High throughput CRISPR-mediated functional validation of regulatory elements,NHGRI,9858384,5UM1HG009402-04,5,UM1,HG,9402,4,,,10339373,"SHEN, YIN  ","REN, BING ","UNIVERSITY OF CALIFORNIA, SAN FRANCISCO",,2020,1552831,
Technology Diffusion in Cancer: Geographic Variations; Facilitators; Outcomes; and Costs,NCI,9931046,5R01CA207216-05,5,R01,CA,207216,5,,,3078010,"SHIH, YA-CHEN TINA",Not Applicable,UNIVERSITY OF TX MD ANDERSON CAN CTR,,2020,273604,
Imaging; Guidance; and QA for Emerging High-Precision Neurosurgical Techniques,NINDS,9783095,1U01NS107133-01A1,1,U01,NS,107133,1,A1,,7682827,"SIEWERDSEN, JEFFREY H",Not Applicable,JOHNS HOPKINS UNIVERSITY,,2019,668624,
Trans-NIH RNAi Facility (TNRF),NCATS,10011453,1ZICTR000041-05,1,ZIC,TR,41,5,,,14380091,"SIMEONOV, ANTON ",Not Applicable,,,2019,1046097,
A Research Resource for Ultra-sensitive High Throughput Proteomics,NIGMS,9745609,5P41GM103493-17,5,P41,GM,103493,17,,,8080536,"SMITH, RICHARD D",Not Applicable,BATTELLE PACIFIC NORTHWEST LABORATORIES,,2019,1604268,
Community Crystallization Resource for Biological Macromolecules,NIGMS,10177813,3R24GM124135-03S1,3,R24,GM,124135,3,S1,,8441213,"SNELL, EDWARD H",Not Applicable,HAUPTMAN-WOODWARD MEDICAL RESEARCH INST,,2020,246073,
Stanford/Salk MoTrPAC Site for Genomes; Epigenomes and Transcriptomes,NIDDK,9840895,5U24DK112348-04,5,U24,DK,112348,4,,,1862128,"SNYDER, MICHAEL P. ","MONTGOMERY, STEPHEN BLAIR",STANFORD UNIVERSITY,,2020,4481145,
Zebrafish Resource Core,NINDS,9968477,5U54NS108251-03,5,U54,NS,108251,3,,7465,1973848,"SOLNICAKREZEL, LILIANNA ",Not Applicable,WASHINGTON UNIVERSITY,,2020,,174698
ImageXpress Micro (IXM) Confocal High-content Imaging System,OD,9707937,1S10OD026899-01,1,S10,OD,26899,1,,,1929389,"SOLOW-CORDERO, DAVID EDWARD",Not Applicable,STANFORD UNIVERSITY,,2019,540802,
Simulation framework to develop ankle exoskeleton gait assistance for older adults,NIA,9871118,1K99AG065524-01,1,K99,AG,65524,1,,,14091857,"SONG, SEUNGMOON ",Not Applicable,STANFORD UNIVERSITY,,2020,128574,
Biostatistics; Informatics and Translational Science,NIA,9962224,5P30AG028747-15,5,P30,AG,28747,15,,6769,6491784,"SORKIN, JOHN D.",Not Applicable,UNIVERSITY OF MARYLAND BALTIMORE,,2020,,203238
Macromolecular X-ray Diffraction Core Research Facility,NIGMS,9744759,5P20GM103546-09,5,P20,GM,103546,9,,8720,1895092,"SPRANG, STEPHEN R",Not Applicable,UNIVERSITY OF MONTANA,,2019,,230664
Task-Driven 3D Interventional Imaging,NIBIB,9899984,5R01EB027127-02,5,R01,EB,27127,2,,,7665807,"STAYMAN, JOSEPH WEBSTER",Not Applicable,JOHNS HOPKINS UNIVERSITY,,2020,405383,
Shared Resource: Proteomics,NCI,9836632,5P30CA022453-38,5,P30,CA,22453,38,,7556,1866142,"STEMMER, PAUL M",Not Applicable,WAYNE STATE UNIVERSITY,,2020,,53016
Predictability in Complex Object Control,NICHD,9733026,5R01HD087089-05,5,R01,HD,87089,5,,,7618869,"STERNAD, DAGMAR ",Not Applicable,NORTHEASTERN UNIVERSITY,,2020,356147,
Project 1 - High Throughtput Drug Screening and Correlations with Mutational Status in Myeloma Cell Lines and Patient Samples,NCI,9985242,4U54CA224018-02,4,U54,CA,224018,2,,8402,6062161,"STEWART, ALEXANDER KEITH",Not Applicable,MAYO CLINIC ARIZONA,,2019,,391500
X-ray Screening and Rapid Structure Determination,NIAID,9786774,8P50AI150476-13,8,P50,AI,150476,13,,7139,1858415,"STROUD, ROBERT M",Not Applicable,"UNIVERSITY OF CALIFORNIA, SAN FRANCISCO",,2019,,200198
High-throughput methyltransferase assays using recombinant nucleosome substrates,NIGMS,9634932,5R44GM117683-03,5,R44,GM,117683,3,,,11923629,"SUN, ZU-WEN ",Not Applicable,"EPICYPHER, INC.",,2019,843888,
Brown/WIH Pelvic Floor Disorders Network Site (UG1),NICHD,9987346,5UG1HD069013-10,5,UG1,HD,69013,10,,,8029991,"SUNG, VIVIAN W",Not Applicable,WOMEN AND INFANTS HOSPITAL-RHODE ISLAND,,2020,263129,
Computer Integrated Systems for Microscopy and Manipulation (CISMM),NIBIB,9689321,5P41EB002025-35,5,P41,EB,2025,35,,,6113930,"SUPERFINE, RICHARD ",Not Applicable,UNIV OF NORTH CAROLINA CHAPEL HILL,,2019,1029148,
Emergent Gaze Perception in Autism Spectrum Disorder,NICHD,9377888,1R15HD090581-01A1,1,R15,HD,90581,1,A1,,10842348,"SWEENY, TIMOTHY ",Not Applicable,UNIVERSITY OF DENVER (COLORADO SEMINARY),,2017,444567,
Molecular Analysis of Corrinoid Specificity,NIGMS,9762938,5R01GM114535-03,5,R01,GM,114535,3,,,8891689,"TAGA, MICHIKO E.",Not Applicable,UNIVERSITY OF CALIFORNIA BERKELEY,,2019,309211,
SCH: GEAR - Grounded Early Adaptive Rehabilitation,NICHD,9348402,5R01HD087133-03,5,R01,HD,87133,3,,,14077486,"TANNER, HERBERT G ","GALLOWAY, JAMES C.;HEINZ, JEFFREY ",UNIVERSITY OF DELAWARE,,2017,477276,
Modeling Treatment-Induced Drug Resistance of Colon Cancer Cells and Treatment Strategies,NCI,9828964,3R15CA216413-01A1S1,3,R15,CA,216413,1,A1S1,,10289665,"TAVANA, HOSSEIN ",Not Applicable,UNIVERSITY OF AKRON,,2019,79244,
Modeling Treatment-Induced Drug Resistance of Colon Cancer Cells and Treatment Strategies,NCI,9442043,1R15CA216413-01A1,1,R15,CA,216413,1,A1,,10289665,"TAVANA, HOSSEIN ",Not Applicable,UNIVERSITY OF AKRON,,2018,467312,
A High Throughput Human Tumor Modeling Technology for Cancer Drug Discovery,NCI,9878078,5R33CA225549-02,5,R33,CA,225549,2,,,10289665,"TAVANA, HOSSEIN  ","LUKER, GARY D",UNIVERSITY OF AKRON,,2020,370110,
Massively parallel mapping of all molecular interactions in a single tube,NHGRI,9737968,5R01HG009065-05,5,R01,HG,9065,5,,,7771080,"TAVAZOIE, SAEED F",Not Applicable,COLUMBIA UNIVERSITY HEALTH SCIENCES,,2019,610261,
EM Studies on Muscle,NIGMS,9904658,5R01GM030598-32,5,R01,GM,30598,32,,,1893792,"TAYLOR, KENNETH ALLEN",Not Applicable,FLORIDA STATE UNIVERSITY,,2020,378286,
Behavioral Mechanisms of Vocal Imitation,NIDCD,9518805,5R01DC004722-20,5,R01,DC,4722,20,,,6521883,"TCHERNICHOVSKI, OFER ",Not Applicable,HUNTER COLLEGE,,2018,326650,
Intraoperative Measurement of Ligament Tension to Guide Knee Arthroplasty,NIBIB,9663300,5R21EB024957-02,5,R21,EB,24957,2,,,1947464,"THELEN, DARRYL G",Not Applicable,UNIVERSITY OF WISCONSIN-MADISON,,2019,185950,
Noninvasive assessment of in vivo tissue loads to enhance the treatment of gait disorders,NICHD,9949739,5R01HD092697-04,5,R01,HD,92697,4,,,1947464,"THELEN, DARRYL G",Not Applicable,UNIVERSITY OF WISCONSIN-MADISON,,2020,300812,
Auditory brain-computer interface for communication,NIMH,9851289,5F32MH118709-02,5,F32,MH,118709,2,,,11836781,"THENGONE, DANIEL JAMES",Not Applicable,BROWN UNIVERSITY,,2020,74810,
Structural Biology Shared Resource,NCI,9867670,5P30CA046934-32,5,P30,CA,46934,32,,5067,6182841,"THEODORESCU, DAN ",Not Applicable,UNIVERSITY OF COLORADO DENVER,,2020,,161760
Precision Medicine Initiative Cohort Program Biobank,OD,9378793,4U24OD023121-02,4,U24,OD,23121,2,,,1863854,"THIBODEAU, STEPHEN NORMAN ","CICEK, MINE ",MAYO CLINIC ROCHESTER,,2020,54240312,
Macromolecular Crystallography Lab,NIGMS,9934238,5P20GM103640-09,5,P20,GM,103640,9,,6339,10770383,"THOMAS, LEONARD M",Not Applicable,UNIVERSITY OF OKLAHOMA NORMAN,,2020,,111648
Transplantation of MHC Homozygous Vascular Progenitors in Primates,NHLBI,9930127,5U01HL134655-05,5,U01,HL,134655,5,,,10603115,"THOMSON, JAMES ALEXANDER",Not Applicable,"MORGRIDGE INSTITUTE FOR RESEARCH, INC.",,2020,1175384,
Core B: Sample Preparation & Storage Core,NIA,9884710,5P01AG051428-05,5,P01,AG,51428,5,,7471,8669540,"TORRELLES, JORDI B",Not Applicable,TEXAS BIOMEDICAL RESEARCH INSTITUTE,,2020,,167390
Glutamate receptors and human neurological disease,NINDS,9923776,5R35NS111619-02,5,R35,NS,111619,2,,,1887223,"TRAYNELIS, STEPHEN F",Not Applicable,EMORY UNIVERSITY,,2020,745173,
Advanced Platform Technology Center,VA,9822814,2I50RX001871-06,2,I50,VA,1871,6,,,1963592,"TRIOLO, RONALD J ","PINAULT, GILLES ",LOUIS STOKES CLEVELAND VA MEDICAL CENTER,,2020,,
