Hybrid neuroprosthesis with power assist for walking in SCI,VA,9768248,5I01RX002275-04,5,I01,VA,2275,4,,,1963592,"TRIOLO, RONALD J",Not Applicable,LOUIS STOKES CLEVELAND VA MEDICAL CENTER,,2019,,
SCH: Multimodal;Task-Aware Movement Assessment and Control: Clinic to Home,NIA,10019455,5R01AG067394-02,5,R01,AG,67394,2,,,16058518,"TRON, ROBERTO  ","AWAD, LOUIS N",BOSTON UNIVERSITY (CHARLES RIVER CAMPUS),,2020,290216,
Compact Navigation System for CT-guided Needle Interventions,NCI,9558828,1UT1CA224886-01A1,1,UT1,CA,224886,1,A1,,10656733,"TSE, TSZ HO ",Not Applicable,"3T TECHNOLOGIES, LLC",,2018,149927,
3D Printed Scaffolds for Primate Spinal Cord Injury Repair,NINDS,9867239,1R01NS114043-01,1,R01,NS,114043,1,,,1867102,"TUSZYNSKI, MARK H. ","KOFFLER, YACOV ","UNIVERSITY OF CALIFORNIA, SAN DIEGO",,2020,656077,
Evaluation of brain recovery of stroke patients using a novel magnetic resonance compatible hand induced robotic device combined with magnetic resonance imaging,NINDS,9934297,5R01NS105875-03,5,R01,NS,105875,3,,,6619212,"TZIKA, A ARIA",Not Applicable,MASSACHUSETTS GENERAL HOSPITAL,,2020,671936,
Task-aware and Autonomous Robotic C-arm Servoing for Flouroscopy-guided Interventions,NIBIB,9972122,1R21EB028505-01A1,1,R21,EB,28505,1,A1,,15247188,"UNBERATH, MATHIAS ",Not Applicable,JOHNS HOPKINS UNIVERSITY,,2020,193784,
JM SISCO PHARMA CONSULTING; LLC:1238758 [18-007319],NIDA,9962191,271201400009I-P00001-27100005-1,,N01,DA,,,,,,Unavailable,Not Applicable,,,2019,45000,
INTEGRATED NONCLINICAL DEVELOPMENT SOLUTIONS; INC.:1212619 [18-006686],NIDA,9932234,271201400013I-P00001-27100005-1,,N01,DA,,,,,,Unavailable,Not Applicable,IND SOLUTIONS,,2019,37625,
IN VITRO STRATEGIES LIMITED LIABILITY COMPANY:1198212 [16-014035]IGF::CL::IGF,NIDA,9918808,271201600009I-P00003-9999-1,,N01,DA,,,,,,Unavailable,Not Applicable,"IN VITRO STRATEGIES, LLC",,2019,35700,
Bimodal Intraoral imaging device for detection of oral epithelial neoplasia,NCI,9917503,1R01CA247595-01,1,R01,CA,247595,1,,,7531167,"VARGAS, GRACIE  ","LI, XINGDE ;LIANG, RONGGUANG ",UNIVERSITY OF TEXAS MED BR GALVESTON,,2020,625021,
Synergistic Effector/Environment encoding: A new perspective on motor cortex and brain-computer interfaces,NINDS,9559085,1DP2NS111817-01,1,DP2,NS,111817,1,,,11309299,"VARGAS-IRWIN, CARLOS ",Not Applicable,BROWN UNIVERSITY,,2018,2437500,
Neural dynamics and adaption for brain machine interface control,NINDS,9765066,5F31NS103409-03,5,F31,NS,103409,3,,,14804658,"VYAS, SAURABH ",Not Applicable,STANFORD UNIVERSITY,,2019,34556,
Opera Phenix high-throughput microplate confocal imager for high-content screening,OD,9708467,1S10OD026839-01,1,S10,OD,26839,1,,,2149621,"WAGNER, BRIDGET K",Not Applicable,"BROAD INSTITUTE, INC.",,2019,1007348,
Development; Evaluation and Translation of Robotic Apparel for Alleviating Low Back Pain,NIAMS,9898052,1UH2AR076731-01,1,UH2,AR,76731,1,,,10720095,"WALSH, CONOR ",Not Applicable,HARVARD UNIVERSITY,,2019,1123769,
Robotic Apparel to Enable Low Force Haptic Cueing for Improving Parkinson's Gait,NCATS,9784913,5U01TR002775-02,5,U01,TR,2775,2,,,10720095,"WALSH, CONOR  ","ELLIS, THERESA ",HARVARD UNIVERSITY,,2019,324272,
Wearable silent speech technology to enhance impaired oral communication,NIDCD,9740858,1R01DC016621-01A1,1,R01,DC,16621,1,A1,,11703703,"WANG, JUN ",Not Applicable,"UNIVERSITY OF TEXAS, AUSTIN",,2019,618564,
Physiology of Inflammatory Arthritis in High Resolution,NIAMS,9984870,5R01AR060350-09,5,R01,AR,60350,9,,,8264724,"WANG, XUEDING ",Not Applicable,UNIVERSITY OF MICHIGAN AT ANN ARBOR,,2020,649047,
A vision-based model of locomotion in crowded environments,NEI,9873968,5R01EY029745-02,5,R01,EY,29745,2,,,1863451,"WARREN, WILLIAM H",Not Applicable,BROWN UNIVERSITY,,2020,512232,
Structural Biology Shared Service,NCI,9750150,5P30CA134274-12,5,P30,CA,134274,12,,8034,2081726,"WEBER, DAVID S",Not Applicable,UNIVERSITY OF MARYLAND BALTIMORE,,2019,,72975
Image Guided Robotic Nephron-Sparing Surgery,NIBIB,9942420,5R01EB023717-04,5,R01,EB,23717,4,,,9047697,"WEBSTER, ROBERT JAMES ","HERRELL, S DUKE;MIGA, MICHAEL IAN",VANDERBILT UNIVERSITY,,2020,353250,
Robot-Enabled Natural Orifice Prostatectomy,NIBIB,9884762,5R01EB026901-02,5,R01,EB,26901,2,,,9047697,"WEBSTER, ROBERT JAMES ","HERRELL, S DUKE",VANDERBILT UNIVERSITY,,2020,536514,
Enabling dexterous surgery at the tip of a flexible endoscope: A low-cost; disposable; steerable sheath.,NIBIB,9845834,1R41EB028229-01A1,1,R41,EB,28229,1,A1,,9047697,"WEBSTER, ROBERT JAMES",Not Applicable,"ENDOTHEIA, INC.",,2019,222874,
Differentiation of Human Pluripotent Stem Cells into Kidney Cell Lineages,NIDDK,9778526,5UH3DK107357-05,5,UH3,DK,107357,5,,,8025217,"WESSELY, OLIVER  ","JENSEN, JAN ",CLEVELAND CLINIC LERNER COM-CWRU,,2019,404500,
Development of a portable and compact robotic system for frameless and maskless stereotactic radiosurgery,NCI,10047519,7R01CA227124-02,7,R01,CA,227124,2,,,10254472,"WIERSMA, RODNEY ",Not Applicable,UNIVERSITY OF PENNSYLVANIA,,2020,276571,
High-Throughput Screening and Validation of Molecular Targeted Chemoradiosensitizers,NCI,9959378,5U01CA220714-03,5,U01,CA,220714,3,,,8543728,"WILLERS, HENNING  ","BENES, CYRIL HENRI",MASSACHUSETTS GENERAL HOSPITAL,,2020,566064,
Drug Discovery and Structural Biology Core,NCI,9849204,5P30CA033572-37,5,P30,CA,33572,37,,5257,8335547,"WILLIAMS, JOHN CHARLES",Not Applicable,BECKMAN RESEARCH INSTITUTE/CITY OF HOPE,,2020,,201526
Drug Discovery and Structural Biology Core,NCI,9688947,5P30CA033572-36,5,P30,CA,33572,36,,5257,8335547,"WILLIAMS, JOHN CHARLES",Not Applicable,BECKMAN RESEARCH INSTITUTE/CITY OF HOPE,,2019,,189083
Neurophysiological and Kinematic Predictors of Response in Chronic Stroke,VA,10086003,5I01RX001667-05,5,I01,VA,1667,5,,,1930520,"WITTENBERG, GEORGE F.",Not Applicable,VETERANS HEALTH ADMINISTRATION,,2020,,
IGF::OT::IGF GARY WOLFE TOXICOLOGY; LLC ,NIDA,9929994,271201400014I-P00001-27100005-1,,N02,DA,,,,,15987908,"WOLFE, GARY ",Not Applicable,,,2019,16200,
Navigation tools for Image Guided Minimally invasive Therapies,CLC,10022063,1ZIACL040011-12,1,ZIA,CL,40011,12,,,9692774,"WOOD, BRADFORD ",Not Applicable,CLINICAL CENTER,,2019,0,
Image Guided Focused Ultrasound For Drug Delivery and Tissue Ablation,CLC,10022064,1ZIACL040012-12,1,ZIA,CL,40012,12,,,9692774,"WOOD, BRADFORD ",Not Applicable,CLINICAL CENTER,,2019,0,
Administrative Core,NIEHS,10007901,5U2CES026561-03,5,U2C,ES,26561,3,,7147,8040323,"WRIGHT, ROBERT O",Not Applicable,ICAHN SCHOOL OF MEDICINE AT MOUNT SINAI,,2020,,167949
Targeted Analysis Resource,NIEHS,10007907,5U2CES026561-03,5,U2C,ES,26561,3,,7149,8040323,"WRIGHT, ROBERT O",Not Applicable,ICAHN SCHOOL OF MEDICINE AT MOUNT SINAI,,2020,,939281
Cluster B: 7 High Throughput Screening,NCI,9914246,5P30CA086862-20,5,P30,CA,86862,20,,7663,10166675,"WU, MENG ",Not Applicable,UNIVERSITY OF IOWA,,2020,,68978
Core-based Scientist specializing in high throughput screening for early drug discovery; target identification and systems biology analysis of cancer,NCI,9849588,1R50CA243786-01,1,R50,CA,243786,1,,,10166675,"WU, MENG ",Not Applicable,UNIVERSITY OF IOWA,,2019,185562,
Neuromuscular mechanisms of specific trunk interventions in children with cerebral palsy,NINDS,9917111,1R01NS115487-01,1,R01,NS,115487,1,,,8290130,"WU, MING ",Not Applicable,REHABILITATION INSTITUTE OF CHICAGO D/B/A SHIRLEY RYAN ABILITYLAB,,2020,390025,
Toxicology in the 21st Century Program (Tox21) - Systems Toxicology,NCATS,10003788,1ZIATR000038-05,1,ZIA,TR,38,5,,,14380131,"XIA, MENGHANG ",Not Applicable,,,2019,642502,
Fall Detection and Prevention for Memory Care through Real-Time Artificial Intelligence Applied to Video,NIA,10020322,5R44AG058354-03,5,R44,AG,58354,3,,,9632042,"XIONG, GLEN ",Not Applicable,"SAFELYYOU, INC.",,2020,493633,
MyoRegulator: A non-invasive neuromodulation device for treatment of spasticity in stroke patients,NINDS,9638603,5U44NS104138-02,5,U44,NS,104138,2,,,15315299,"YAGHOUBI, NADER ",Not Applicable,"PATHMAKER NEUROSYSTEMS, INC.",,2019,1036705,
Effects of device-assisted practice of activities of daily living in a close-to-normal pattern on upper extremity motor recovery in individuals with moderate to severe stroke,NICHD,9783874,5R01HD095187-02,5,R01,HD,95187,2,,,8246662,"YAO, JUN ",Not Applicable,NORTHWESTERN UNIVERSITY AT CHICAGO,,2019,366704,
Portable automated device for rapid venous blood draws and point of care diagnostic analysis,NIBIB,9502278,5R01EB020036-04,5,R01,EB,20036,4,,,1879411,"YARMUSH, MARTIN L",Not Applicable,"RUTGERS, THE STATE UNIV OF N.J.",,2018,646766,
UVA molecular electron microscopy core for the Mid-Atlantic region,NIGMS,9775251,5U24GM116790-03,5,U24,GM,116790,3,,,1858004,"YEAGER, MARK JAY ","GALKIN, VITOLD ;SAMSO, MONTSERRAT ;TAYLOR, DEREK JAMES;UNGER, VINZENZ ;ZHANG, PEIJUN ",UNIVERSITY OF VIRGINIA,,2019,323000,
Improving Community Ambulation for Stroke Survivors using Powered Hip Exoskeletons with Adaptive Environmental Controllers,NICHD,9906245,5R03HD097740-02,5,R03,HD,97740,2,,,12336696,"YOUNG, AARON JOHN",Not Applicable,GEORGIA INSTITUTE OF TECHNOLOGY,,2020,146686,
A transposase system for integrative ChIP-exo and ATAC-seq analysis at single-cell resolution,NHGRI,9948716,5R01HG010211-03,5,R01,HG,10211,3,,,9402648,"ZEITLINGER, JULIA ",Not Applicable,STOWERS INSTITUTE FOR MEDICAL RESEARCH,,2020,527588,
Multiparametric Photoacoustic Imaging-Based Identification of Aggressive Prostate Cancer,OD,9795033,1DP5OD028162-01,1,DP5,OD,28162,1,,,14641945,"ZHANG, HAICHONG ",Not Applicable,WORCESTER POLYTECHNIC INSTITUTE,,2019,382110,
Real-time Non-Rigid 3D Reconstruction and Registration for Laparoscopic-guided Minimally Invasive Liver Surgery,NIBIB,9822028,1K99EB027177-01A1,1,K99,EB,27177,1,A1,,14957844,"ZHOU, HAOYIN ",Not Applicable,BRIGHAM AND WOMEN'S HOSPITAL,,2019,93280,